index,published,keyword,domain,language,valid,title,description,url,image,archive,content,quote,de,en,la,added
5513c7e62460627b606ffb53535f4905,2025-10-21T14:51:32Z,'Herbst',www.diepresse.com,de,0.0,Wie Balkon und Terrasse in knalligen Herbstfarben erstrahlen [premium],"Nicht nur Bäume zeigen im Herbst tollste Farben, auch manch kleinere Pflanzen färben ihr Laub auf das Prächtigste um. Deshalb könnte man beim Bepflanzen von Balkonen und Vorgärtchen ein paar Herbstschönheiten einstreuen.",https://www.diepresse.com/20213832/wie-balkon-und-terrasse-in-knalligen-herbstfarben-erstrahlen,https://img.diepresse.com/public/incoming/8wcdxk-kein-Titel/alternates/DPR_SOCIAL_MAGAZIN/kein%20Titel,,"Hinaus, hinaus in die Wälder und in die Parks, kann man dieser Tage nur raten, denn der Herbst hat längst schon seine Pinsel ausgepackt und malt die Landschaft neu in buntesten Farben. Der Herbst ist… [+1507 chars]",,"Wie Balkon und Terrasse in knalligen Herbstfarben erstrahlen [premium]. Nicht nur Bäume zeigen im Herbst tollste Farben, auch manch kleinere Pflanzen färben ihr Laub auf das Prächtigste um. Deshalb könnte man beim Bepflanzen von Balkonen und Vorgärtchen ein paar Herbstschönheiten einstreuen.","How the balcony and terrace shine in bright autumn colors [premium]. It's not just trees that show the most amazing colors in autumn, some smaller plants also change their foliage to the most magnificent colors. That's why you could sprinkle in a few autumn beauties when planting on balconies and front gardens.","Qualiter solarium et solarium purpureo autumno lucent colore. Arbores non modo in autumno mirabiles colores ostendunt, nonnullae quoque plantae minores in amplissimis coloribus suam frondem mutant. Quam ob rem paucis autumnalibus pulchritudines in maenianis et hortis anterioribus adspergere potuisti.",2025-10-22 02:01:58+00:00
1e97aa993583d6fed26b660e4acd88cc,2025-10-21T15:26:09Z,'Ernte',www.bild.de,de,0.0,Ein echtes Unikat - Ernte-Monster wird zum XXL-Grill,Im mexikanischen Bundesstaat Chihuahua wird ein Landwirtschafts-Monster zur Grill-Attraktion.,https://www.bild.de/news/ein-echtes-unikat-ernte-monster-wird-zum-xxl-grill-68f71d45e5a6fb7162df0c55,"https://images.bild.de/68f71d45e5a6fb7162df0c55/c1a0b9b041f5b0c56d9274cc7664a75f,c63f1417?w=1280",,"Mehr zum Video anzeigen 
Im mexikanischen Bundesstaat Chihuahua wird ein Landwirtschafts-Monster zur Grill-Attraktion.
Quelle: Festival De Otoño Cuauhtemoc21.10.2025 - 17:26 Uhr",,Ein echtes Unikat - Ernte-Monster wird zum XXL-Grill. Im mexikanischen Bundesstaat Chihuahua wird ein Landwirtschafts-Monster zur Grill-Attraktion.,"A truly unique piece - Harvest Monster becomes an XXL grill. In the Mexican state of Chihuahua, an agricultural monster becomes a barbecue attraction.",Unicum vere fragmentum - Harvest Monster XXI craticula fit. In Mexicana civitate Chihuahua monstrum agriculturae fit attractio barbecue.,2025-10-22 02:01:58+00:00
2e195a57c25f4d5d98cf772bb61b46bf,2025-10-21T17:00:00Z,'Herbst',www.fitforfun.de,de,0.0,Power für den Herbst: Das gesündeste Gemüse der Welt hat Hochsaison – das solltest du wissen,"Im Oktober hat Brunnenkresse Saison. Das heimische Superfood steckt voller Vitamine, stärkt dein Immunsystem und bringt Frische in deine Herbstküche.",https://www.fitforfun.de/gesunde-ernaehrung/power-fuer-den-herbst-das-gesuendeste-gemuese-der-welt-hat-hochsaison-das-solltest-du-wissen-775635.html,"https://www.fitforfun.de/files/images/202510/1/brunnenkresse-ist-gesund,775671_3x2_n.jpg",,"Lesetipp
Lesetipp",,"Power für den Herbst: Das gesündeste Gemüse der Welt hat Hochsaison – das solltest du wissen. Im Oktober hat Brunnenkresse Saison. Das heimische Superfood steckt voller Vitamine, stärkt dein Immunsystem und bringt Frische in deine Herbstküche.","Power for autumn: The healthiest vegetables in the world are in peak season – you should know that. Watercress is in season in October. The local superfood is full of vitamins, strengthens your immune system and brings freshness to your autumn kitchen.","Potentia autumni: Saluberrima legumina in mundo in summo tempore sunt – scire debes. Sisymbrium tempestivum est mense Octobri. Cibus localis plenus vitamins est, systema immune tuum confirmat et viriditatem ad culinam autumni tui affert.",2025-10-22 02:01:58+00:00
eb0a92eca50d81759e10db359dae4f36,2025-10-21T17:21:25Z,'Herbst',www.kino.de,de,0.0,"Nur für Gryffindors: Elbenwald verkauft gemütliches ""Harry Potter""-Strickkleid zum absoluten Zauberpreis","Der Herbst ruft – und mit ihm kommen gemütliche und wärmende Kleidungsstücke wie das „Harry Potter“-Strickkleid, das derzeit als Schnäppchen zu haben ist.",https://www.kino.de/film/nur-fuer-gryffindors-elbenwald-verkauft-gemuetliches-harry-potter-strickkleid-zum-absoluten-zauberpreis--01K83WMEQ85WWJKXPJEPCYVWGW,https://static.kino.de/cd/4f/41/c590c1905b3dcdddc05087ac33_cmUgMTkyMCAxMDgwA2NmYzA5YmNkNTcz.jpeg,,"Der Herbst ruft und mit ihm kommen gemütliche und wärmende Kleidungsstücke wie das Harry Potter-Strickkleid, das derzeit als Schnäppchen zu haben ist.
Die Tage werden dunkler, kürzer und laden somit… [+2100 chars]",,"Nur für Gryffindors: Elbenwald verkauft gemütliches ""Harry Potter""-Strickkleid zum absoluten Zauberpreis. Der Herbst ruft – und mit ihm kommen gemütliche und wärmende Kleidungsstücke wie das „Harry Potter“-Strickkleid, das derzeit als Schnäppchen zu haben ist.","Only for Gryffindors: Elbenwald sells cozy “Harry Potter” knitted dresses at an absolutely magical price. Autumn is calling - and with it comes cozy and warming items of clothing like the “Harry Potter” knitted dress, which is currently available as a bargain.","Tantum Gryffindors: Elbenwaldus fovere vendit ""Harrius Potter"" vestem omnino magicam pretio contexuit. Autumnus vocat - et cum eo venit fovere et fovere vasa vestimentorum sicut ""Harrius Potter"" vestem subtectam, quae nunc in promptu est pro pacto.",2025-10-22 02:01:58+00:00
8d34dceeb06c9a1f73af13f76c5207dc,2025-10-21T17:30:00Z,'Herbst',www.stern.de,de,0.0,"""Monster Muse"": Düsterer Make-up-Trend für den Herbst","Gruselig schön: So gelingt ein Herbst-Make-up-Trend, der geheimnisvolle Dunkelheit und lebendige Frische kombiniert.",https://www.stern.de/kultur/-monster-muse---duesterer-make-up-trend-fuer-den-herbst-36150754.html,https://image.stern.de/36150758/t/Z8/v1/w1440/r1.7778/-/21--duesterer-make-up-trend-fuer-den-herbst---16-9---spoton-article-1118075.jpg,,"Kopiere den aktuellen Link
Zur Merkliste hinzufügen
Gruselig schön: So gelingt ein Herbst-Make-up-Trend, der geheimnisvolle Dunkelheit und lebendige Frische kombiniert.
Pünktlich zur Spooky Season… [+1924 chars]",,"""Monster Muse"": Düsterer Make-up-Trend für den Herbst. Gruselig schön: So gelingt ein Herbst-Make-up-Trend, der geheimnisvolle Dunkelheit und lebendige Frische kombiniert.",“Monster Muse”: Dark makeup trend for fall. Creepy beautiful: This is how you can achieve an autumn make-up trend that combines mysterious darkness and lively freshness.,"""Monstra Musa"": Obscurae rutrum inclinatio ad ruinam. Creepy formosa: Hoc modo consequi potes autumnum, flecte quod arcanas tenebras componit et viriditatem vivam.",2025-10-22 02:01:58+00:00
26f754f6c0da36b43b643886fe9b7263,2025-10-21T17:35:27Z,'Herbst',www.kino.de,de,0.0,"4,93 von 5 Sternen: Elbenwald verkauft beliebte ""Harry Potter""-Kuscheldecke jetzt zum magischen Sparpreis",Der Herbst wird kuschelig und „Potterheads“ machen es sich in einer Kuscheldecke mit populärem Motiv gemütlich.,https://www.kino.de/film/4-93-von-5-sternen-elbenwald-verkauft-beliebte-harry-potter-kuscheldecke-jetzt-zum-magischen-sparpreis--01K83XE4Y3NRAJT72E8HQFZJWW,https://static.kino.de/54/da/44/5fd14f8842654afb6da1e8a148_cmUgMTkyMCAxMDgwAzVhNTE4MjRiYTg0.jpeg,,"Der Herbst wird kuschelig und Potterheads machen es sich in einer Kuscheldecke mit populärem Motiv gemütlich.
Wenn es eine Bestseller-Liste mit nützlichen Gegenständen aus allen Harry Potter-Filmen … [+2201 chars]",,"4,93 von 5 Sternen: Elbenwald verkauft beliebte ""Harry Potter""-Kuscheldecke jetzt zum magischen Sparpreis. Der Herbst wird kuschelig und „Potterheads“ machen es sich in einer Kuscheldecke mit populärem Motiv gemütlich.",4.93 out of 5 stars: Elbenwald is now selling the popular “Harry Potter” cuddly blanket at a magical savings price. Autumn is getting cozy and “Potterheads” are making themselves comfortable in a cozy blanket with a popular motif.,"4.93 ex 5 stellis: Elbenwald nunc popularem ""Harrium Potter"" stragulum venditat pretio magico peculi. Autumnus facit fovere et ""Potterheads"" se consolari faciunt in fovere stragulum cum argumento populari.",2025-10-22 02:01:58+00:00
7fe720b26ebd678d4ca25bb82633dbe3,2025-10-22T02:00:30Z,'Winter',www.stern.de,de,0.0,Wintersport: Feldberg plant Saisonstart Ende November,Todtnau (lsw) - Das große Skigebiet Feldberg im Hochschwarzwald will am 29. November die Wintersportsaison einläuten - falls der Schnee auf den Pisten,https://www.stern.de/gesellschaft/regional/baden-wuerttemberg/wintersport--feldberg-plant-saisonstart-ende-november-36151158.html,https://image.stern.de/36151160/t/9i/v1/w1440/r1.7778/-/22--nl37p3pq64v8axs2048jpeg---391bca0658d0eacd.jpg,,"Kopiere den aktuellen Link
Zur Merkliste hinzufügen
Das Skigebiet Feldberg im Schwarzwald bereitet sich für die Wintersportsaison vor. Einen Starttermin gibt es auch schon. Liegt dann genug Schnee?… [+2040 chars]",,Wintersport: Feldberg plant Saisonstart Ende November. Todtnau (lsw) - Das große Skigebiet Feldberg im Hochschwarzwald will am 29. November die Wintersportsaison einläuten - falls der Schnee auf den Pisten,Winter sports: Feldberg plans to start the season at the end of November. Todtnau (lsw) - The large Feldberg ski area in the Upper Black Forest wants to ring in the winter sports season on November 29th - if there is snow on the slopes,Ludis hibernis: Feldberg cogitat tempus initium in fine Novembris. Todtnau (lsw) - Magna Feldberg ski area in Silva Nigra Superiore in ludis temporum hibernis pulsare vult die 29 Novembris - si nix in devexa est,2025-10-22 02:01:58+00:00
56262679de91c47d683d9bc61566eb6f,2025-10-22T03:30:00Z,'Sommer',www.nzz.ch,de,0.0,Frustrierte Weinbauern: Starker Regen im September drückt die deutsche Weinernte auf den tiefsten Stand seit 15 Jahren,Qualität wird Quantität überwiegen. Damit trösten sich viele deutsche Weinbauern. Nach einem schönen Sommer litten vor allem die grossen deutschen Anbaugebiete unter dem nassen Wetter im Frühherbst.,https://www.nzz.ch/wirtschaft/frustrierte-weinbauern-starker-regen-im-september-drueckt-die-deutsche-weinernte-auf-den-tiefsten-stand-seit-15-jahren-ld.1907965,"https://img.nzz.ch/2025/10/21/8b4f4636-a82f-4b62-8317-be38e1501039.jpg?width=1200&height=675&fit=bounds&quality=75&auto=webp&crop=5523,3107,x0,y0&wmark=nzz",,"Qualität wird Quantität überwiegen. Damit trösten sich viele deutsche Weinbauern. Nach einem schönen Sommer litten vor allem die grossen deutschen Anbaugebiete unter dem nassen Wetter im Frühherbst.… [+5131 chars]",,Frustrierte Weinbauern: Starker Regen im September drückt die deutsche Weinernte auf den tiefsten Stand seit 15 Jahren. Qualität wird Quantität überwiegen. Damit trösten sich viele deutsche Weinbauern. Nach einem schönen Sommer litten vor allem die grossen deutschen Anbaugebiete unter dem nassen Wetter im Frühherbst.,"Frustrated winegrowers: Heavy rain in September pushed the German wine harvest to its lowest level in 15 years. Quality will outweigh quantity. Many German winegrowers console themselves with this. After a beautiful summer, the large German growing areas in particular suffered from the wet weather in early autumn.","Frustratur winegrowers: Imber gravis mense Septembri messem vinariam Germanicam impulit ad ultimum 15 annos. Qualitas praeponderat quantitatis. Multi Germani vinitores hoc se consolantur. Post pulchram aestatem, magnae Germaniae regiones maxime crescentes tempestatibus humidis primo autumno laborarunt.",2025-10-22 02:01:58+00:00
fb3fa9eb932cf7437c59497142a6acbe,2025-10-22T05:50:53Z,'Schnee',www.zeit.de,de,0.0,Vorhersage: Herbstwetter mit Wolken und Regen - Schnee in den Hochlagen,Hier finden Sie Informationen zu dem Thema „Vorhersage“. Lesen Sie jetzt „Herbstwetter mit Wolken und Regen - Schnee in den Hochlagen“.,https://www.zeit.de/news/2025-10/22/herbstwetter-mit-wolken-und-regen-schnee-in-den-hochlagen,https://img.zeit.de/news/2025-10/22/herbstwetter-mit-wolken-und-regen-schnee-in-den-hochlagen-image-group/wide__1300x731,,"Der goldene Herbst bleibt in Bayern in den nächsten Tagen aus, stattdessen wird es stürmisch. Laut dem Deutschen Wetterdienst (DWD) bringen atlantische Tiefdruckgebiete zunächst milde, aber feuchte L… [+781 chars]",,Vorhersage: Herbstwetter mit Wolken und Regen - Schnee in den Hochlagen. Hier finden Sie Informationen zu dem Thema „Vorhersage“. Lesen Sie jetzt „Herbstwetter mit Wolken und Regen - Schnee in den Hochlagen“.,Forecast: Autumn weather with clouds and rain - snow in the high altitudes. Here you will find information on the topic of “prediction”. Now read “Autumn weather with clouds and rain - snow in the high altitudes”.,"Praedictio: Autumnus tempestas cum nubibus et pluviis - nix in altitudinibus superioribus. Hic informationes invenies in argumento ""praedictionis"". Nunc legitur ""Tempestas autumnus cum nubibus et pluviis - nix in altis altitudinibus"".",2025-10-22 02:01:58+00:00
e2ed56ae22eaa8f92e82efb818065ad0,2025-10-22T06:00:00Z,'Herbst',www.telepolis.de,de,0.0,Maronen: Die unterschätzte Powerfrucht des Herbstes,"Esskastanien galten lange als ""Brot der Armen"". Heute erleben sie eine Renaissance. Welche Kastanien essbar sind und wie man sie sonst noch nutzen kann.",https://www.telepolis.de/features/Maronen-Die-unterschaetzte-Powerfrucht-des-Herbstes-10793770.html,https://heise.cloudimg.io/bound/1200x1200/q85.png-lossy-85.webp-lossy-85.foil1/_www-heise-de_/imgs/18/4/9/6/0/5/7/4/shutterstock_2683720391-2c06abc159478364.jpeg,,"(Bild: Didebashvili.GEO / Shutterstock.com)
Esskastanien galten lange als ""Brot der Armen"". Heute erleben sie eine Renaissance. Welche Kastanien essbar sind und wie man sie sonst noch nutzen kann.
… [+7223 chars]",,"Maronen: Die unterschätzte Powerfrucht des Herbstes. Esskastanien galten lange als ""Brot der Armen"". Heute erleben sie eine Renaissance. Welche Kastanien essbar sind und wie man sie sonst noch nutzen kann.",Chestnuts: The underrated power fruit of autumn. Chestnuts have long been considered the “bread of the poor.” Today they are experiencing a renaissance. Which chestnuts are edible and how else you can use them.,Castaneae: De virtute otiosorum autumni fructus. Castaneae iamdudum consideratae sunt panis pauperum. Hodie experiuntur saltationem. Quae castaneae eduntur et quomodo eis uti potes.,2025-10-22 02:01:58+00:00
fea60ce8918d97dad7153112149fb8ec,2025-10-22T07:22:08Z,'Ernte',www.bild.de,de,0.0,70 Prozent der Weinernte verloren - Ist Jahrgang 2024 wirklich so schlecht?,Der umstrittene Jahrgang 2024 überrascht mit Qualität trotz widriger Bedingungen. Die besten Weine aus Deutschland – getestet vom BILD-Weinkolumnisten.,https://www.bild.de/leben-wissen/food-essen-trinken-rezepte/der-wein-jahrgang-2024-ist-besser-als-sein-ruf-68f62966c95b23d2659ffbd3,"https://images.bild.de/68f62966c95b23d2659ffbd3/b74cc1cb3b0b648d11dd918e7110396b,578fb39?w=1280",,"Um den TTS Player darzustellen, brauchen wir deine Zustimmung. 
 externen Inhalt aktivieren Um eingebettete Inhalte anzuzeigen, ist Ihre jederzeit widerrufliche Einwilligung (über den Schalter oder … [+2893 chars]",,70 Prozent der Weinernte verloren - Ist Jahrgang 2024 wirklich so schlecht?. Der umstrittene Jahrgang 2024 überrascht mit Qualität trotz widriger Bedingungen. Die besten Weine aus Deutschland – getestet vom BILD-Weinkolumnisten.,70 percent of the wine harvest lost - is the 2024 vintage really that bad? The controversial 2024 vintage surprises with quality despite adverse conditions. The best wines from Germany – tested by the BILD wine columnist.,70 percent vini messis amissa est - estne 2024 vindemia vere mala? Controversiae 2024 vindemia opprimit qualitatem adversae condiciones obstante. Vina optima e Germania - probata a VALENS vino columnista.,2025-10-22 02:01:58+00:00
24beb1ad54e1fa2c4cca4efc733f4823,2025-10-22T09:45:45Z,'Herbst',www.tagesschau.de,de,0.0,Vogelgrippe breitet sich aus - Hunderte Kraniche verendet,Mit dem Vogelzug breitet sich im Herbst auch die Vogelgrippe wieder verstärkt aus. In diesem Jahr sorgt sie vor allem bei Kranichen für ein Massensterben. In mehreren Bundesländern wurde der Erreger auch in Geflügelbetrieben nachgewiesen.,https://www.tagesschau.de/inland/ausbreitung-vogelgrippe-100.html,https://images.tagesschau.de/image/1cdae4d1-8dda-4d95-b1bd-7696eaab21b4/AAABmgsaH7s/AAABmgWmh8Q/16x9-big/kraniche-132.jpg?width=1280,,"Stand: 22.10.2025 11:45 Uhr
Mit dem Vogelzug breitet sich im Herbst auch die Vogelgrippe wieder verstärkt aus. In diesem Jahr sorgt sie vor allem bei Kranichen für ein Massensterben. In mehreren Bun… [+4550 chars]",,Vogelgrippe breitet sich aus - Hunderte Kraniche verendet. Mit dem Vogelzug breitet sich im Herbst auch die Vogelgrippe wieder verstärkt aus. In diesem Jahr sorgt sie vor allem bei Kranichen für ein Massensterben. In mehreren Bundesländern wurde der Erreger auch in Geflügelbetrieben nachgewiesen.,"Bird flu is spreading - hundreds of cranes have died. With the migration of birds, bird flu also spreads again in autumn. This year it is causing a mass die-off, especially of cranes. The pathogen has also been detected in poultry farms in several federal states.","Avis flu patula est — centeni grues mortui sunt. Migrantibus avibus, avis flu etiam autumno iterum diffunditur. Hoc anno massam morientium-abstulit, praesertim inter grues. pathogen etiam in praediis gallinis in pluribus civitatibus foederatis detectum est.",2025-10-22 02:01:58+00:00
060b62ea6f46562715112ebf41120efc,2025-10-22T10:18:51Z,'Erle',www.focus.de,de,0.0,Video aufgetaucht: Israelische Siedler schlagen palästinensische Bauern nieder,Israelische Siedler greifen palästinensische Olivenbauern während der Ernte an. Eine Frau wurde schwer verletzt ins Krankenhaus gebracht. Siedlerangriffe im Westjordanland nehmen aktuell zu.,https://www.focus.de/politik/ausland/video-aufgetaucht-israelische-siedler-schlagen-palaestinensische-bauern-nieder_977554db-9365-4adf-8b94-202ebbed8e52.html,https://quadro.burda-forward.de/ctf/f3028dc4-3836-4e95-899a-2efc30ce11ab.e343fdf1-a75e-482d-b150-5b7b91ba6610.jpeg?im=RegionOfInterestCrop%3D%281200%2C630%29%2CregionOfInterest%3D%28777%2C790%29&hash=18051136b53843e230406f2040863d9e000ef84a57986a67118e52a243f62abd,,"Im israelisch besetzten Westjordanland haben israelische Siedler palästinensische Olivenbauern angegriffen. Laut Videos, die der Nachrichtenagentur Associated Press (AP) vorliegen, schlugen maskierte… [+1489 chars]",,Video aufgetaucht: Israelische Siedler schlagen palästinensische Bauern nieder. Israelische Siedler greifen palästinensische Olivenbauern während der Ernte an. Eine Frau wurde schwer verletzt ins Krankenhaus gebracht. Siedlerangriffe im Westjordanland nehmen aktuell zu.,Video surfaced: Israeli settlers beat Palestinian farmers. Israeli settlers attack Palestinian olive farmers during the harvest. A woman was taken to hospital with serious injuries. Settler attacks in the West Bank are currently increasing.,Video emersisse: Palaestinae agricolae colonos Israeli verberaverunt. Israelis coloni Palaestinae agricolae messis invadunt. Foemina gravibus iniuriis in nosocomium delata est. Inquilinus impetus in Occidente Bank augentur.,2025-10-22 02:01:58+00:00
b6ccdee203939ba79a56a268b0312c92,2025-10-22T12:06:20Z,'Winter',www.stern.de,de,0.0,Dunkelheit und Witterung: Von Ranzen bis Reifen - Darauf kommt es jetzt im Verkehr an,"Mit der Zeitumstellung wird es früher dunkel, zudem rückt der Winter näher. Was sollten Auto-, Fahrradfahrer und Fußgänger jetzt im Verkehr beachten?",https://www.stern.de/gesellschaft/regional/sachsen-anhalt/dunkelheit-und-witterung--von-ranzen-bis-reifen---darauf-kommt-es-jetzt-im-verkehr-an-36152880.html,https://image.stern.de/36152882/t/Ib/v1/w1440/r1.7778/-/22--6mswigluv2v7axs2048jpeg---ec2d6af3bb96b51f.jpg,,"Kopiere den aktuellen Link
Zur Merkliste hinzufügen
Mit der Zeitumstellung wird es früher dunkel, zudem rückt der Winter näher. Was sollten Auto-, Fahrradfahrer und Fußgänger jetzt im Verkehr beach… [+1046 chars]",,"Dunkelheit und Witterung: Von Ranzen bis Reifen - Darauf kommt es jetzt im Verkehr an. Mit der Zeitumstellung wird es früher dunkel, zudem rückt der Winter näher. Was sollten Auto-, Fahrradfahrer und Fußgänger jetzt im Verkehr beachten?","Darkness and weather: From satchels to tires - that's what's important in traffic now. With the time change, it gets dark earlier and winter is getting closer. What should drivers, cyclists and pedestrians pay attention to in traffic?","Tenebrae et tempestates: Ex sacculis ad tires - id quod nunc est momenti in negotiatione. Cum temporis mutatio, ante tenebras accipit, et hiems appropinquat. Quid agentes, Eques et Pedestres mercaturae operam attendere debent?",2025-10-22 02:01:58+00:00
b71de649fecf61801a54185b3d590d72,2025-10-22T15:00:00Z,'Ernte',sz-magazin.sueddeutsche.de,de,0.0,A bissl Powidl ins Tascherl,"Aus Kartoffeln, Mehl und Topfen macht Hans Gerlach gemütlich herbstliche Teigtaschen mit süßer Füllung. Er krönt sie mit buttrigen Nussbröseln – und verrät, wo man die besten Haselnüsse dafür bekommt.",https://sz-magazin.sueddeutsche.de/probier-doch-mal/teigtaschen-powidl-95545,https://szm-media.sueddeutsche.de/image/szm/e234a2c7c6e6cc16a5a1d63269e15d52/t131l0w1850h971/1280/image.jpeg,,Weder süß noch salzig ist der Kartoffelteig für diese gemütlich herbstlichen Teigtaschen aus den Resten vom Fotoshooting habe ich später Gnocchi gerollt. Doch mit der passenden Füllung und leicht süß… [+6032 chars],,"A bissl Powidl ins Tascherl. Aus Kartoffeln, Mehl und Topfen macht Hans Gerlach gemütlich herbstliche Teigtaschen mit süßer Füllung. Er krönt sie mit buttrigen Nussbröseln – und verrät, wo man die besten Haselnüsse dafür bekommt.","A little Powidl in your pocket. Hans Gerlach makes cozy autumn dumplings with a sweet filling from potatoes, flour and curd cheese. He tops it off with buttery nut crumbs - and reveals where you can get the best hazelnuts for it.","Paulo Powidl in sacculo tuo. Hans Gerlach fovere autumnos globos facit dulci impletione potatoes, farina et caseo butyrum. Ille eam cum micas nucis butyri aufert - ostenditque ubi optimas avellanas habere possis.",2025-10-22 02:01:58+00:00
1ab9657a790903628b04777b0ec0fd91,2025-10-23T04:03:09Z,'Schnee',www.zeit.de,de,0.0,Wetter: Sturm und Schnee im Anmarsch – Kaltfront trifft Südwesten,Hier finden Sie Informationen zu dem Thema „Wetter“. Lesen Sie jetzt „Sturm und Schnee im Anmarsch – Kaltfront trifft Südwesten“.,https://www.zeit.de/news/2025-10/23/sturm-und-schnee-im-anmarsch-kaltfront-trifft-suedwesten,https://img.zeit.de/news/2025-10/23/sturm-und-schnee-im-anmarsch-kaltfront-trifft-suedwesten-image-group/wide__1300x731,,"Baden-Württemberg steht ein ungemütlicher Wetterumschwung bevor. Der Deutsche Wetterdienst (DWD) rechnet im Südwesten mit schweren Sturmböen und teils kräftigem Regen. Wer draußen unterwegs ist, soll… [+1381 chars]",,Wetter: Sturm und Schnee im Anmarsch – Kaltfront trifft Südwesten. Hier finden Sie Informationen zu dem Thema „Wetter“. Lesen Sie jetzt „Sturm und Schnee im Anmarsch – Kaltfront trifft Südwesten“.,Weather: Storm and snow approaching – cold front hits southwest. Here you will find information on the topic of “weather”. Read “Storm and snow approaching – cold front hits southwest” now.,"Tempestas: Tempestas et nix appropinquans - frigus ante meridiem ferit. Hic informationes invenies in argumento ""tempestatis"". Lege ""Tempestas et nix appropinquans - frigus ante meridiem ferit"" nunc.",2025-10-22 02:01:58+00:00
a19a47afbf0cbaa12483be1e77f0752b,2025-10-23T04:07:44Z,'Gewitter',www.zeit.de,de,0.0,Wetter: Gewitter und Sturmböen in Sachsen-Anhalt möglich,Hier finden Sie Informationen zu dem Thema „Wetter“. Lesen Sie jetzt „Gewitter und Sturmböen in Sachsen-Anhalt möglich“.,https://www.zeit.de/news/2025-10/23/gewitter-und-sturmboeen-in-sachsen-anhalt-moeglich,https://img.zeit.de/news/2025-10/23/gewitter-und-sturmboeen-in-sachsen-anhalt-moeglich-image-group/wide__1300x731,,In Sachsen-Anhalt wird es heute ungemütlich. Nach Angaben des Deutschen Wetterdienstes (DWD) wird der Morgen bewölkt und regnerisch. Im Tagesverlauf kann es zu Gewittern kommen. Im Harz seien sogar S… [+433 chars],,Wetter: Gewitter und Sturmböen in Sachsen-Anhalt möglich. Hier finden Sie Informationen zu dem Thema „Wetter“. Lesen Sie jetzt „Gewitter und Sturmböen in Sachsen-Anhalt möglich“.,Weather: Thunderstorms and squalls possible in Saxony-Anhalt. Here you will find information on the topic of “weather”. Now read “Thunderstorms and squalls possible in Saxony-Anhalt”.,"Tempestas: Procellae et procellae in Saxonia-Anhalt fieri possunt. Hic informationes invenies in argumento ""tempestatis"". Nunc legitur ""procellae et procellae in Saxonia-Anhalt.""",2025-10-22 02:01:58+00:00
