index,url,valid,domain,title,description,image,published,archive,content,quote,language,keyword
https://www.tagesschau.de/wissen/klima/schweizer-alpen-gletscher-schmelze-100.html,https://www.tagesschau.de/wissen/klima/schweizer-alpen-gletscher-schmelze-100.html,0,www.tagesschau.de,Schweizer Alpen-Gletscher schmelzen weiter in Rekordtempo,"Die Gletscher in den Alpen schwinden im Rekordtempo. Schneemangel und Hitzewellen haben auch in diesem Jahr die Eisschmelze vorangetrieben, zeigt ein Bericht. Seit 2015 ist ein Viertel des ""ewigen Eises"" geschmolzen. Von Kathrin Hondl.",https://images.tagesschau.de/image/209699be-0e12-45a0-b1a9-baff94f507a1/AAABmZ9Kl4Y/AAABmKJZ-0g/16x9-big/clariden-100.jpg?width=1280,2025-10-01T11:02:00Z,,"Stand: 01.10.2025 13:02 Uhr
Die Gletscher in den Alpen schwinden im Rekordtempo. Schneemangel und Hitzewellen haben auch in diesem Jahr die Eisschmelze vorangetrieben, zeigt ein Bericht. Seit 2015 i… [+4464 chars]",,de,'Schnee'
https://www.stern.de/panorama/busunglueck--berichte--erdrutsch-begraebt-bus-in-indien---viele-tote-36113182.html,https://www.stern.de/panorama/busunglueck--berichte--erdrutsch-begraebt-bus-in-indien---viele-tote-36113182.html,0,www.stern.de,Busunglück: Berichte: Erdrutsch begräbt Bus in Indien - viele Tote,Neu-Delhi - Ein massiver Erdrutsch hat im Norden Indiens einen Bus mit zahlreichen Fahrgästen erfasst und unter sich begraben. Mindestens 18 Menschen,https://image.stern.de/36113184/t/4T/v1/w1440/r1.7778/-/07--qrsgvgnwezv2axs2048jpeg---d595a11be51bc734.jpg,2025-10-07T19:35:08Z,,"Kopiere den aktuellen Link
Zur Merkliste hinzufügen
Ein Bus wird in Nordindien von einem Erdrutsch erfasst. Es gibt zahlreiche Tote.
Ein massiver Erdrutsch hat im Norden Indiens einen Bus mit zahl… [+979 chars]",,de,'Erdrutsch'
https://www.zeit.de/news/2025-10/07/berichte-erdrutsch-begraebt-bus-in-indien-viele-tote,https://www.zeit.de/news/2025-10/07/berichte-erdrutsch-begraebt-bus-in-indien-viele-tote,0,www.zeit.de,Busunglück: Berichte: Erdrutsch begräbt Bus in Indien - viele Tote,Hier finden Sie Informationen zu dem Thema „Busunglück“. Lesen Sie jetzt „Berichte: Erdrutsch begräbt Bus in Indien - viele Tote“.,https://img.zeit.de/news/2025-10/07/berichte-erdrutsch-begraebt-bus-in-indien-viele-tote-image-group/wide__1300x731,2025-10-07T19:35:08Z,,Ein massiver Erdrutsch hat im Norden Indiens einen Bus mit zahlreichen Fahrgästen erfasst und unter sich begraben. Mindestens 18 Menschen seien bei dem Unglück auf einer Straße im Bezirk Bilaspur im … [+883 chars],,de,'Erdrutsch'
https://www.tagesspiegel.de/gesellschaft/panorama/busungluck-berichte-erdrutsch-begrabt-bus-in-indien-viele-tote-14501459.html,https://www.tagesspiegel.de/gesellschaft/panorama/busungluck-berichte-erdrutsch-begrabt-bus-in-indien-viele-tote-14501459.html,0,www.tagesspiegel.de,Busunglück: Berichte: Erdrutsch begräbt Bus in Indien - viele Tote,Ein Bus wird in Nordindien von einem Erdrutsch erfasst. Es gibt zahlreiche Tote.,https://www.tagesspiegel.de/images/14501456/alternates/BASE_16_9_W1400/1759865780000/indien-krankenwagen.jpeg,2025-10-07T19:36:20Z,,Ein massiver Erdrutsch hat im Norden Indiens einen Bus mit zahlreichen Fahrgästen erfasst und unter sich begraben. Mindestens 18 Menschen seien bei dem Unglück auf einer Straße im Bezirk Bilaspur im … [+937 chars],,de,'Erdrutsch'
https://www.morgenpost.de/panorama/article410176421/massiver-erdrutsch-reisst-bus-in-indien-mit-mindestens-15-tote.html,https://www.morgenpost.de/panorama/article410176421/massiver-erdrutsch-reisst-bus-in-indien-mit-mindestens-15-tote.html,0,www.morgenpost.de,Massiver Erdrutsch reißt Bus in Indien mit – mindestens 15 Tote,Tragisches Unglück im Norden Indiens: Ein Erdrutsch hat einen Bus mitgerissen. Es gibt zahlreiche Tote – doch auch überlebende Kinder.,https://img.sparknews.funkemedien.de/410176420/410176420_1759866895_v16_9_1600.jpeg,2025-10-07T19:54:55Z,,"Bei einem Erdrutsch infolge heftiger Regenfälle ist im Norden Indiens ein Bus mitgerissen worden. Mindestens 15 Menschen seien dabei ums Leben gekommen, teilten die Behörden im Bundesstaat Himachal P… [+1693 chars]",,de,'Erdrutsch'
https://www.stern.de/panorama/weltgeschehen/indien--erdrutsch-reisst-bus-mit-sich---mindestens-15-tote-36113246.html,https://www.stern.de/panorama/weltgeschehen/indien--erdrutsch-reisst-bus-mit-sich---mindestens-15-tote-36113246.html,0,www.stern.de,Indien: Erdrutsch begräbt Bus unter sich – mindestens 15 Tote,"Seit Tagen regnet es in Indien heftig. Nachdem bereits in Darjeeling viele Menschen ums Leben gekommen sind, kommt es in einem anderen Staat zu einem weiteren Unglück.",https://image.stern.de/36113184/t/YE/v2/w1440/r1.7778/-/07--qrsgvgnwezv2axs2048jpeg---d595a11be51bc734.jpg,2025-10-07T22:12:00Z,,"Kopiere den aktuellen Link
Zur Merkliste hinzufügen
Seit Tagen regnet es in Indien heftig. Nachdem bereits in Darjeeling viele Menschen ums Leben gekommen sind, kommt es in einem anderen Staat zu e… [+1318 chars]",,de,'Erdrutsch'
https://www.nzz.ch/wirtschaft/erdrutsche-geobrugg-verkauft-schutznetze-vom-thurgau-in-alle-welt-ld.1905991,https://www.nzz.ch/wirtschaft/erdrutsche-geobrugg-verkauft-schutznetze-vom-thurgau-in-alle-welt-ld.1905991,0,www.nzz.ch,"Die Risiken wegen Steinschlags und Erdrutschen mehren sich. Eine Thurgauer Firma hofft, daraus das grosse Geschäft zu machen","Wer am Hang wohnt, muss sein Haus zunehmend vor Naturgefahren schützen. Die Firma Geobrugg stellt dafür Stahlnetze her und will international expandieren. Wären da nicht die amerikanischen Zölle.","https://img.nzz.ch/2025/10/08/005bc9b3-a8b9-410e-af6e-e4e757b7583a.jpg?width=1200&height=675&fit=bounds&quality=75&auto=webp&crop=5568,3132,x0,y0&wmark=nzz",2025-10-11T03:30:00Z,,"Wer am Hang wohnt, muss sein Haus zunehmend vor Naturgefahren schützen. Die Firma Geobrugg stellt dafür Stahlnetze her und will international expandieren. Wären da nicht die amerikanischen Zölle.
Do… [+8236 chars]",,de,'Steinschlag'
https://www.tagesschau.de/ausland/amerika/mexiko-ueberschwemmungen-tote-100.html,https://www.tagesschau.de/ausland/amerika/mexiko-ueberschwemmungen-tote-100.html,0,www.tagesschau.de,Mehr als 60 Tote bei Überschwemmungen in Mexiko,"In Mexiko regnet es seit Tagen heftig, Erdrutsche begraben ganze Straßen. Die schweren Unwetter mit Überschwemmungen haben inzwischen mehr als 60 Menschen das Leben gekostet. Entspannung ist vorerst nicht in Sicht.",https://images.tagesschau.de/image/1b3c9921-5018-4bb2-abb7-436fd8f1f5f6/AAABmd6Ck_A/AAABmKJZ-0g/16x9-big/mexiko-ueberschwemmung-102.jpg?width=1280,2025-10-13T17:16:02Z,,"Stand: 13.10.2025 19:16 Uhr
In Mexiko regnet es seit Tagen heftig, Erdrutsche begraben ganze Straßen. Die schweren Unwetter mit Überschwemmungen haben inzwischen mehr als 60 Menschen das Leben gekos… [+2086 chars]",,de,'Erdrutsch'
https://www.zeit.de/2025/44/klimawandel-alaska-permafrost-abtauen-temperatur-boden,https://www.zeit.de/2025/44/klimawandel-alaska-permafrost-abtauen-temperatur-boden,0,www.zeit.de,Klimawandel: Wenn der Boden weicht,"In Alaska verschwindet binnen Stunden ein See. Der Grund: tauender Permafrost. Forscher wollen nun wissen, wann das System kippen könnte und ganze Landschaften verändern.",https://img.zeit.de/2025/44/wenn-der-boden-weicht-bild-6/wide__1300x731,2025-10-15T14:50:40Z,,"Am Morgen war der See noch da. Als Susan Tessier mit dem Quad, ihrem vierrädrigen Geländefahrzeug, zur Arbeit aufgebrochen war, hatte sie kurz angehalten. Und von der Anhöhe neben ihrem Haus in der T… [+1059 chars]",,de,'Permafrost'
https://www.zeit.de/2025/44/permafrost-klimawandel-kohlenstoff-methan-schmelzen-gxe,https://www.zeit.de/2025/44/permafrost-klimawandel-kohlenstoff-methan-schmelzen-gxe,0,www.zeit.de,"Permafrost: ""Wie eine Gefriertruhe""","In den arktischen Böden ruhen riesige Mengen Kohlenstoff. Tauen sie, entsteht Methan. Der Klimaforscher Thomas Kleinen erklärt, was Permafrost zum Klima-Kipppunkt macht.",https://img.zeit.de/2025/44/wie-eine-gefriertruhe-bild-2/wide__1300x731,2025-10-15T14:51:18Z,,"Seen, die binnen Stunden leerlaufen, Böden, die absacken, Methan, das entweicht: Tauender Permafrost verändert die Arktis rasant und damit das Weltklima. Der Klimaforscher Thomas Kleinen vom Max-Plan… [+861 chars]",,de,'Frost'
https://www.faz.net/aktuell/wissen/erde-klima/was-hinter-den-mysterioesen-kratern-in-westsibirien-steckt-110730673.html,https://www.faz.net/aktuell/wissen/erde-klima/was-hinter-den-mysterioesen-kratern-in-westsibirien-steckt-110730673.html,0,www.faz.net,Rätsel gelöst: Wenn der Permafrost plötzlich explodiert,"Seit Jahren geben seltsame Krater in Westsibirien Rätsel auf. Nun glauben norwegische Geoforscher die Ursache gefunden zu haben. Sie machen Erdgas unter den Dauerfrostböden, aber auch den Klimawandel verantwortlich.",https://media1.faz.net/ppmedia/w1200/aktuell/2718121521/1.10730669/facebook_teaser/ergebnis-einer-heftigen-erdgas.jpg.webp,2025-10-16T08:16:23Z,,"Schon seit einiger Zeit versuchen Geowissenschaftler, den Ursprung merkwürdiger Löcher zu ergründen, die erstmals vor gut einem Jahrzehnt in einem eng begrenzten Gebiet in Sibirien entdeckt wurden. M… [+506 chars]",,de,'Frost'
https://www.diepresse.com/20224200/der-wahlsieger-in-nordzypern-will-die-geteilte-insel-wiedervereinigen,https://www.diepresse.com/20224200/der-wahlsieger-in-nordzypern-will-die-geteilte-insel-wiedervereinigen,0,www.diepresse.com,Der Wahlsieger in Nordzypern will die geteilte Insel wiedervereinigen [premium],Tufan Erhürman gewann bei der Wahl im türkischen Norden mit einem Erdrutschsieg. Er plant Gespräche mit dem griechischen Süden. Doch die Regierung in Ankara könnte seine Pläne durchkreuzen.,https://img.diepresse.com/public/incoming/q1ct3z-TOPSHOT-CYPRUS-TRNC-TURKEY-CONFLICT-POLITICS-VOTE/alternates/DPR_SOCIAL_NACHRICHTEN/TOPSHOT-CYPRUS-TRNC-TURKEY-CONFLICT-POLITICS-VOTE,2025-10-20T13:47:59Z,,Das Grummeln der türkischen Zyprer über die magere Bilanz ihrer Regierung und die Einmischung aus Ankara war unüberhörbar aber mit einem Erdrutschsieg des pro-europäischen Kandidaten Tufan Erhürman b… [+3565 chars],,de,'Erdrutsch'
