index,published,keyword,domain,language,valid,title,description,url,image,archive,content,quote,de,en,la,added
da296c1e3244c29bff2cffb983a28b6b,2025-10-21T05:26:44Z,'Gewitter',www.stern.de,de,0.1,Wechselhaftes Wetter: Wolken und Regen in Nordrhein-Westfalen,"Essen (lnw) - In den nächsten Tagen bestimmen Wolken und Regen das Wetter in Nordrhein-Westfalen. Wie der Deutsche Wetterdienst (DWD) mitteilte, gibt es",https://www.stern.de/gesellschaft/regional/nordrhein-westfalen/wechselhaftes-wetter--wolken-und-regen-in-nordrhein-westfalen-36147682.html,https://image.stern.de/36147684/t/hd/v1/w1440/r1.7778/-/21--zpisngtbfvv17axs2048jpeg---c97649cc5cb2e46d.jpg,,"Kopiere den aktuellen Link
Zur Merkliste hinzufügen
Der Deutsche Wetterdienst erwartet teils kräftige Schauer und Gewitter und kaum Veränderung bei den Temperaturen.
In den nächsten Tagen bestimme… [+628 chars]",,"Wechselhaftes Wetter: Wolken und Regen in Nordrhein-Westfalen. Essen (lnw) - In den nächsten Tagen bestimmen Wolken und Regen das Wetter in Nordrhein-Westfalen. Wie der Deutsche Wetterdienst (DWD) mitteilte, gibt es","Changeable weather: clouds and rain in North Rhine-Westphalia. Essen (lnw) - Over the next few days, clouds and rain will determine the weather in North Rhine-Westphalia. As the German Weather Service (DWD) announced, there are","Tempestas mutabilis: nubes et pluviae in North Rheno-Westphalia. Essen (lnw) - Post paucos dies nubes et pluviae tempestates in Rheno-Westphalia septentrionali determinabunt. Ut Tempestas Servitium Germanicum (DWD) nuntiatum est, sunt",2025-10-22 02:01:58+00:00
e7653f58e5adfeb8c9aba318b94cd1b9,2025-10-21T07:38:38Z,'Ernte',www.faz.net,de,0.1,Solarzellen im Weinberg: Grüner Strom und gesunde Reben,"Solarmodule über Weinbergen könnten den Weinbau nachhaltiger machen. Im Rheingau testen Forscher, wie Agri-Photovoltaik Reben schützt und Erträge sichert.",https://www.faz.net/aktuell/rhein-main/region-und-hessen/agri-photovoltaik-in-rheingauer-weinbergen-gruener-strom-und-gesunde-reben-accg-110739474.html,https://media1.faz.net/ppmedia/w1200/aktuell/3855196966/1.10739473/facebook_teaser/stromspeicher-die-trauben-sind.jpg.webp,,"Für viele Landwirte ist die Energieerzeugung längst zu einem bedeutenden Geschäftsfeld geworden. Der Betrieb von Biogasanlagen, die Installation möglichst vieler Solarmodule auf großen Scheunendächer… [+6340 chars]",,"Solarzellen im Weinberg: Grüner Strom und gesunde Reben. Solarmodule über Weinbergen könnten den Weinbau nachhaltiger machen. Im Rheingau testen Forscher, wie Agri-Photovoltaik Reben schützt und Erträge sichert.","Solar cells in the vineyard: Green electricity and healthy vines. Solar panels over vineyards could make viticulture more sustainable. In the Rheingau, researchers are testing how agricultural photovoltaics protect vines and secure yields.",Cellae solares in vinea: electricitatis viridis et vineae sanae. Tabulae solares super vineas plus sustineri posse uinearum faciunt. In Rheingau exploratores explorant quomodo agriculturae photovoltaicae vites defendant et secura cedat.,2025-10-22 02:01:58+00:00
62cfa4511608f4b3056b13a4f1bebb8e,2025-10-22T04:53:49Z,'Gewitter',www.zeit.de,de,0.1,Wetter: Sturmtief bringt Regen und starke Böen nach Hessen,Hier finden Sie Informationen zu dem Thema „Wetter“. Lesen Sie jetzt „Sturmtief bringt Regen und starke Böen nach Hessen“.,https://www.zeit.de/news/2025-10/22/sturmtief-bringt-regen-und-starke-boeen-nach-hessen,https://img.zeit.de/news/2025-10/22/sturmtief-bringt-regen-und-starke-boeen-nach-hessen-image-group/wide__1300x731,,"Diese Woche wird es ungemütlich in Hessen: Ein Tief über der Nordsee sorgt für Sturm, Regen und Gewitter. Laut Deutschem Wetterdienst (DWD) sind Starkregen und stürmische Böen möglich.
Am Mittwoch i… [+1546 chars]",,Wetter: Sturmtief bringt Regen und starke Böen nach Hessen. Hier finden Sie Informationen zu dem Thema „Wetter“. Lesen Sie jetzt „Sturmtief bringt Regen und starke Böen nach Hessen“.,Weather: Storm brings rain and strong gusts to Hesse. Here you will find information on the topic of “weather”. Now read “Storm depth brings rain and strong gusts to Hesse”.,"Tempestas: Tempestas pluvias et procellas Hassiae affert. Hic informationes invenies in argumento ""tempestatis"". Nunc legitur ""Tempestas profunditas pluvias et fortes procellas Hassiae"".",2025-10-22 02:01:58+00:00
4e178c2ed6fc562ec5bb7b5075ca7ce9,2025-10-22T10:27:32Z,'Gewitter',www.zeit.de,de,0.1,Sturmfluten möglich: Sturmtief erwartet – Gefahr von orkanartigen Böen,Hier finden Sie Informationen zu dem Thema „Sturmfluten möglich“. Lesen Sie jetzt „Sturmtief erwartet – Gefahr von orkanartigen Böen“.,https://www.zeit.de/news/2025-10/22/sturmtief-erwartet-gefahr-von-orkanartigen-boeen,https://img.zeit.de/news/2025-10/22/sturmtief-erwartet-gefahr-von-orkanartigen-boeen-image-group/wide__1300x731,,"Kräftiger Wind, außerdem Regenschauer und Gewitter: In den kommenden Tagen soll es in Niedersachsen und Bremen sehr stürmisch werden. Vom Ärmelkanal her nähert sich in der Nacht zum Donnerstag Sturmt… [+1605 chars]",,Sturmfluten möglich: Sturmtief erwartet – Gefahr von orkanartigen Böen. Hier finden Sie Informationen zu dem Thema „Sturmfluten möglich“. Lesen Sie jetzt „Sturmtief erwartet – Gefahr von orkanartigen Böen“.,Storm surges possible: Storm depression expected - danger of hurricane-like gusts. Here you will find information on the topic “Storm surges possible”. Now read “Storm depression expected – danger of hurricane-like gusts”.,"Tempestas surget possibilis: tempestas tristitia expectatur - periculum procellae sicut procellae. Hic informationes invenies in argumento ""Tempestas fieri potest"". Nunc lege ""Tempestas tristitia expectata - periculum turbinis instar procellis"".",2025-10-22 02:01:58+00:00
d0e0ec6f6ae28fba5427c27cd39ebaa4,2025-10-23T11:55:00Z,'Hochwasser',www.zeit.de,de,0.1,Kritische Infrastruktur: Kommandeur mahnt zu mehr Eigenvorsorge im Krisenfall,Hier finden Sie Informationen zu dem Thema „Kritische Infrastruktur“. Lesen Sie jetzt „Kommandeur mahnt zu mehr Eigenvorsorge im Krisenfall“.,https://www.zeit.de/news/2025-10/23/kommandeur-mahnt-zu-mehr-eigenvorsorge-im-krisenfall,https://img.zeit.de/news/2025-10/23/kommandeur-mahnt-zu-mehr-eigenvorsorge-im-krisenfall-image-group/wide__1300x731,,"Die Bundeswehr in Thüringen hat zu mehr Eigenvorsorge im Krisenfall gemahnt. Noch immer würden sich zu viele Menschen in Deutschland darauf verlassen, dass sich «schon irgendjemand» darum kümmern wer… [+1709 chars]",,Kritische Infrastruktur: Kommandeur mahnt zu mehr Eigenvorsorge im Krisenfall. Hier finden Sie Informationen zu dem Thema „Kritische Infrastruktur“. Lesen Sie jetzt „Kommandeur mahnt zu mehr Eigenvorsorge im Krisenfall“.,Critical infrastructure: Commander calls for more personal precautions in the event of a crisis. Here you will find information on the topic of “Critical Infrastructure”. Now read “Commander calls for more personal precautions in the event of a crisis”.,"Critica infrastructura: Imperator plures cautiones personales in eventu discriminis requirit. Hic informationes invenies in argumento ""Infrastructure Criticae"". Nunc legitur ""Praefectus plures cautiones personales in eventu discriminis"" vocat.",2025-10-22 02:01:58+00:00
66f76d7f0f0ac6162c96ed3c962fa797,2025-10-24T04:20:07Z,'Schnee',www.zeit.de,de,0.1,Wetterprognose: Das Wochenende in Hessen bleibt grau und nass,Hier finden Sie Informationen zu dem Thema „Wetterprognose“. Lesen Sie jetzt „Das Wochenende in Hessen bleibt grau und nass“.,https://www.zeit.de/news/2025-10/24/das-wochenende-in-hessen-bleibt-grau-und-nass,https://img.zeit.de/news/2025-10/24/das-wochenende-in-hessen-bleibt-grau-und-nass-image-group/wide__1300x731,,Das Sturmtief «Joshua» über der Nordsee sorgt auch in Hessen weiterhin für unbeständiges und windiges Wetter. Nach Angaben des Deutschen Wetterdienstes (DWD) werden bis zum Abend an manchen Orten Stu… [+896 chars],,Wetterprognose: Das Wochenende in Hessen bleibt grau und nass. Hier finden Sie Informationen zu dem Thema „Wetterprognose“. Lesen Sie jetzt „Das Wochenende in Hessen bleibt grau und nass“.,Weather forecast: The weekend in Hesse will remain gray and wet. Here you will find information on the topic of “weather forecast”. Read now “The weekend in Hesse remains gray and wet”.,"Tempestas praenuntietur: Volutpat in Hassia cinerea et humida manebit. Hic informationes invenies in argumento ""tempestatis praesagio"". Lege nunc "" auctor in Hassia manet griseus et humidus"".",2025-10-22 02:01:58+00:00
ea7d7687a3b05cf3f6f82ff0a2bae48e,2025-10-24T07:30:10Z,'Ernte',www.stern.de,de,0.1,Schilf-Glasflügelzikade: Wie man in der Elbaue der Zikade Herr werden will,"Bisher schadet sie vor allem Zuckerrüben: Die Schilf-Glasflügelzikade ist ein Problem für Landwirte. Der Bundeslandwirtschaftsminister informiert sich in einer Modellregion, wie man sie loswird.",https://www.stern.de/gesellschaft/regional/sachsen-anhalt/schilf-glasfluegelzikade--wie-man-in-der-elbaue-der-zikade-herr-werden-will-36158266.html,https://image.stern.de/36158268/t/29/v1/w1440/r1.7778/-/24--nwfwgywhccv4axs2048jpeg---8533150e779f5d7b.jpg,,"Kopiere den aktuellen Link
Zur Merkliste hinzufügen
Bisher schadet sie vor allem Zuckerrüben: Die Schilf-Glasflügelzikade ist ein Problem für Landwirte. Der Bundeslandwirtschaftsminister informiert… [+2201 chars]",,"Schilf-Glasflügelzikade: Wie man in der Elbaue der Zikade Herr werden will. Bisher schadet sie vor allem Zuckerrüben: Die Schilf-Glasflügelzikade ist ein Problem für Landwirte. Der Bundeslandwirtschaftsminister informiert sich in einer Modellregion, wie man sie loswird.",Reed cicada: How to control the cicada in the Elbe. So far it has primarily damaged sugar beets: the reed leafhopper is a problem for farmers. The Federal Minister of Agriculture is finding out how to get rid of them in a model region.,Reed cicada: Quam cicada in Albis compescere. Hactenus imprimis laesum saccharo betae habet: calamus folium agricolae quaestio est. Minister foederalis agriculturae excogitat quomodo eos in regione exemplarium relegare possit.,2025-10-22 02:01:58+00:00
b17d67224e48d99f5199306b93b9ea20,2025-10-24T07:32:48Z,'Hochwasser',www.zeit.de,de,0.1,Sturmflut: Elbe schwappt am späten Nachmittag auf den Fischmarkt,Hier finden Sie Informationen zu dem Thema „Sturmflut“. Lesen Sie jetzt „Elbe schwappt am späten Nachmittag auf den Fischmarkt“.,https://www.zeit.de/news/2025-10/24/elbe-schwappt-am-spaeten-nachmittag-auf-den-fischmarkt,https://img.zeit.de/news/2025-10/24/elbe-schwappt-am-spaeten-nachmittag-auf-den-fischmarkt-image-group/wide__1300x731,,"In der Elbe und an der Nordseeküste wird am Nachmittag eine Sturmflut erwartet. Die Pegelstände werden an der nordfriesischen Küste auf 2,0 bis 2,5 Meter und im Elbegebiet auf 1,5 bis 2,0 Meter höher… [+1480 chars]",,Sturmflut: Elbe schwappt am späten Nachmittag auf den Fischmarkt. Hier finden Sie Informationen zu dem Thema „Sturmflut“. Lesen Sie jetzt „Elbe schwappt am späten Nachmittag auf den Fischmarkt“.,Storm surge: Elbe spills into the fish market in the late afternoon. Here you will find information on the topic of “storm surge”. Now read “Elbe spills over into the fish market in the late afternoon”.,"Tempestas fluctuat: Albis in forum piscem in sero post meridiem effunditur. Hic informationes invenies in argumento ""soris procellae"". Nunc lege ""Elbe in forum piscarium in sero post meridiem"".",2025-10-22 02:01:58+00:00
dd28ee2d4fbc5312ceba59a935d6d3a1,2025-10-24T07:32:48Z,'Hochwasser',www.stern.de,de,0.1,Sturmflut: Elbe schwappt am späten Nachmittag auf den Fischmarkt,Der Wind drückt das Wasser von der Nordsee in die Elbe – und lässt die Flut höher steigen als sonst. Am Nachmittag erreichen die Wasserstände der Elbe Sturmflut-Niveau.,https://www.stern.de/gesellschaft/regional/hamburg-schleswig-holstein/sturmflut--elbe-schwappt-am-spaeten-nachmittag-auf-den-fischmarkt-36158280.html,https://image.stern.de/36158282/t/j9/v1/w1440/r1.7778/-/24--kizpre7mhfv3axs2048jpeg---48c3587163d81697.jpg,,"Kopiere den aktuellen Link
Zur Merkliste hinzufügen
Der Wind drückt das Wasser von der Nordsee in die Elbe und lässt die Flut höher steigen als sonst. Am Nachmittag erreichen die Wasserstände der E… [+1662 chars]",,Sturmflut: Elbe schwappt am späten Nachmittag auf den Fischmarkt. Der Wind drückt das Wasser von der Nordsee in die Elbe – und lässt die Flut höher steigen als sonst. Am Nachmittag erreichen die Wasserstände der Elbe Sturmflut-Niveau.,"Storm surge: Elbe spills into the fish market in the late afternoon. The wind pushes the water from the North Sea into the Elbe - and causes the tide to rise higher than usual. In the afternoon, the water levels in the Elbe reach storm surge levels.","Tempestas fluctuat: Albis in forum piscem in sero post meridiem effunditur. Ventus aquam e mari septentrionali in Albim impellit, et aestus solito altiores facit. In meridiem, aquae gradus in Albis perveniunt impetus tempestatis gradus.",2025-10-22 02:01:58+00:00
d9cd19e4cdabf7bd595ad31b551690f7,2025-10-24T08:02:00Z,'Laub',www.stern.de,de,0.1,"Deutscher Urlauber bei Sturm ""Benjamin"" auf Insel Korsika gestorben","Ein deutscher Urlauber auf der französischen Mittelmeerinsel Korsika ist bei dem Sturm ""Benjamin"" ums Leben gekommen. Der 45-jährige Mann habe gemeinsam mit seiner Ehefrau und ihren zwei Kindern in einem Fluss gebadet, als der Wasserpegel infolge heftiger Gew…",https://www.stern.de/news/deutscher-urlauber-bei-sturm--benjamin--auf-insel-korsika-gestorben-36158576.html,https://image.stern.de/36158578/t/bB/v2/w1440/r1.7778/-/herbststurm-benjamin-zog-ueber-frankreich-hinweg.jpg,,"Kopiere den aktuellen Link
Zur Merkliste hinzufügen
Ein deutscher Urlauber auf der französischen Mittelmeerinsel Korsika ist bei dem Sturm ""Benjamin"" ums Leben gekommen. Der 45-jährige Mann habe ge… [+891 chars]",,"Deutscher Urlauber bei Sturm ""Benjamin"" auf Insel Korsika gestorben. Ein deutscher Urlauber auf der französischen Mittelmeerinsel Korsika ist bei dem Sturm ""Benjamin"" ums Leben gekommen. Der 45-jährige Mann habe gemeinsam mit seiner Ehefrau und ihren zwei Kindern in einem Fluss gebadet, als der Wasserpegel infolge heftiger Gew…",German holidaymaker died in storm “Benjamin” on the island of Corsica. A German holidaymaker on the French Mediterranean island of Corsica died in storm Benjamin. The 45-year-old man was bathing in a river with his wife and their two children when the water level rose due to heavy...,"In insula Corsica ""Benjamin"" in insula Corsicae feriae Germanicae tempestatibus mortuus est. Germanus feriatus in insula Corsica Mediterraneo Gallico in Beniamin expugnatione mortuus est. XLV annos natus est cum uxore et duobus liberis in flumine lavabatur cum aqua gradu gravi ex ...",2025-10-22 02:01:58+00:00
b7472c987b4e61308518f30c848d6589,2025-10-24T18:23:56Z,'Hochwasser',www.stern.de,de,0.1,"Sturmflut: ""Joshua"" bringt Sturmflut - Elbe schwappt auf Fischmarkt","Mehr als 70 Sturmeinsätze, ausgefallene Fähren und eine amtliche Unwetterwarnung: Über der Nordsee ist ein Sturmtief unterwegs, das auch den Norden Deutschlands durchpustet.",https://www.stern.de/gesellschaft/regional/hamburg-schleswig-holstein/sturmflut---joshua--bringt-sturmflut---elbe-schwappt-auf-fischmarkt-36158280.html,https://image.stern.de/36160570/t/Ho/v1/w1440/r1.7778/-/24--gw6h6oea5rv7axs2048jpeg---0b463920f5964d91.jpg,,"Kopiere den aktuellen Link
Zur Merkliste hinzufügen
Mehr als 70 Sturmeinsätze, ausgefallene Fähren und eine amtliche Unwetterwarnung: Über der Nordsee ist ein Sturmtief unterwegs, das auch den Nord… [+2821 chars]",,"Sturmflut: ""Joshua"" bringt Sturmflut - Elbe schwappt auf Fischmarkt. Mehr als 70 Sturmeinsätze, ausgefallene Fähren und eine amtliche Unwetterwarnung: Über der Nordsee ist ein Sturmtief unterwegs, das auch den Norden Deutschlands durchpustet.","Storm surge: ""Joshua"" brings storm surge - Elbe spills into fish market. More than 70 storm operations, canceled ferries and an official storm warning: a storm is on the way across the North Sea and is also blowing through northern Germany.","Tempestas fluctuat: ""Joshua"" procellam affert - Albis in forum piscem redundat. Plus quam 70 tempestas operationes ferries cassavit et procellam officialem observavit: tempestas in via trans mare septentrionale est et etiam per Germaniam septentrionalem flavit.",2025-10-22 02:01:58+00:00
09124ac165d50a4f792db3713aa7a806,2025-10-25T03:00:12Z,'Hochwasser',www.zeit.de,de,0.1,Naturschutz: 35 Jahre Bergwaldprojekt - wie sich der Wald verändert hat,Hier finden Sie Informationen zu dem Thema „Naturschutz“. Lesen Sie jetzt „35 Jahre Bergwaldprojekt - wie sich der Wald verändert hat“.,https://www.zeit.de/news/2025-10/25/35-jahre-bergwaldprojekt-wie-sich-der-wald-veraendert-hat,https://img.zeit.de/news/2025-10/25/35-jahre-bergwaldprojekt-wie-sich-der-wald-veraendert-hat-image-group/wide__1300x731,,"Hunderttausende Bäume gepflanzt, Moore wiedervernässt, Bäche renaturiert seit 35 Jahren engagiert sich das Bergwaldprojekt mit zahlreichen Aktionen für die Natur in Niedersachsen. Mit einer Baumpflan… [+4265 chars]",,Naturschutz: 35 Jahre Bergwaldprojekt - wie sich der Wald verändert hat. Hier finden Sie Informationen zu dem Thema „Naturschutz“. Lesen Sie jetzt „35 Jahre Bergwaldprojekt - wie sich der Wald verändert hat“.,Nature conservation: 35 years of mountain forest project - how the forest has changed. Here you will find information on the topic of “nature conservation”. Now read “35 years of mountain forest project - how the forest has changed”.,"Natura conservationis: XXXV annos silvae montis project - silva quomodo mutatur. Hic informationes invenies in argumento ""naturae conservationis"". Nunc lege ""35 annos montis silvae proiectum - quomodo silva mutata est"".",2025-10-22 02:01:58+00:00
b96e1da493efe4fdcb690a16c2d427a6,2025-10-26T06:00:10Z,'Ernte',www.zeit.de,de,0.1,"Filme zum Gruseln: Nervenkitzel gefällig? Filme, die nicht schlafen lassen","Hier finden Sie Informationen zu dem Thema „Filme zum Gruseln“. Lesen Sie jetzt „Nervenkitzel gefällig? Filme, die nicht schlafen lassen“.",https://www.zeit.de/news/2025-10/26/nervenkitzel-gefaellig-filme-die-nicht-schlafen-lassen,https://img.zeit.de/news/2025-10/26/nervenkitzel-gefaellig-filme-die-nicht-schlafen-lassen-image-group/wide__1300x731,,"Von «Nosferatu» bis zu Netflix-Horror: Was vor mehr als 100 Jahren mit ein paar schaurigen Filmtricks begann, ist heute aus der Popkultur nicht mehr wegzudenken. Klassiker, ikonische Monster, Psychot… [+5187 chars]",,"Filme zum Gruseln: Nervenkitzel gefällig? Filme, die nicht schlafen lassen. Hier finden Sie Informationen zu dem Thema „Filme zum Gruseln“. Lesen Sie jetzt „Nervenkitzel gefällig? Filme, die nicht schlafen lassen“.","Scary films: Want a thrill? Films that won't let you sleep. Hier finden Sie Informationen zu dem Thema „Filme zum Gruseln“. Lesen Sie jetzt „Nervenkitzel gefällig? Filme, die nicht schlafen lassen“.","FORMIDULOSUS cinematographica: Vis miratur? Membrana quae non te dormiat. Hic informationes invenies in argumento ""FORMIDULI cinematographici"". Lege ""Nice pertemptat? Membrana quae non te dormiunt"" nunc.",2025-10-22 02:01:58+00:00
f6425d385a3b0173afa4613fc3b5902b,2025-10-26T11:25:27Z,'Schnee',www.zeit.de,de,0.1,Wetter: Erste Flocken auf dem Brocken,Hier finden Sie Informationen zu dem Thema „Wetter“. Lesen Sie jetzt „Erste Flocken auf dem Brocken“.,https://www.zeit.de/news/2025-10/26/erste-flocken-auf-dem-brocken,https://img.zeit.de/news/2025-10/26/erste-flocken-auf-dem-brocken-image-group/wide__1300x731,,"Bei minus zwei Grad Celsius sind auf dem Brocken die ersten Schneeflocken der Saison gefallen. Bis auf eine Höhe von etwa 600 Meter sei es etwas weiß geworden, sagte ein Meteorologe des Deutschen Wet… [+561 chars]",,Wetter: Erste Flocken auf dem Brocken. Hier finden Sie Informationen zu dem Thema „Wetter“. Lesen Sie jetzt „Erste Flocken auf dem Brocken“.,Weather: First flakes on the Brocken. Here you will find information on the topic of “weather”. Read “First flakes on the Brocken” now.,"Weather: Primum incanduit in Brocken. Hic informationes invenies in argumento ""tempestatis"". Lege ""Primum incanduit in Brocken"" nunc.",2025-10-22 02:01:58+00:00
0108f98de3671d0ce9ae974a789fc79e,2025-10-26T15:17:00Z,'Apfelernte',www.stern.de,de,0.1,"""Tatort"" aus Hannover: Oh Schreck, der Kopf ist weg: Furtwängler darf Detektivin spielen","Im ""Tatort"" aus Hannover stößt Kommissarin Lindholm auf einen skurrilen Fall: Ein Bauer wurde enthauptet – aber der Kopf fehlt. Ein spannendes Detektivspiel beginnt.",https://www.stern.de/kultur/tv/tatort/tatort-heute-aus-hannover--maria-furtwaengler-ermittelt-im-alten-land-36155548.html,https://image.stern.de/36155550/t/zM/v2/w1440/r1.7778/-/tatort-hannover-die-letzte-ernte.jpg,,"Kopiere den aktuellen Link
Zur Merkliste hinzufügen
Im ""Tatort"" aus Hannover stößt Kommissarin Lindholm auf einen skurrilen Fall: Ein Bauer wurde enthauptet aber der Kopf fehlt. Ein spannendes Dete… [+2850 chars]",,"""Tatort"" aus Hannover: Oh Schreck, der Kopf ist weg: Furtwängler darf Detektivin spielen. Im ""Tatort"" aus Hannover stößt Kommissarin Lindholm auf einen skurrilen Fall: Ein Bauer wurde enthauptet – aber der Kopf fehlt. Ein spannendes Detektivspiel beginnt.","“Tatort” from Hanover: Oh shock, the head is gone: Furtwängler gets to play detective. In the ""crime scene"" from Hanover, Commissioner Lindholm comes across a bizarre case: a farmer was beheaded - but the head is missing. An exciting detective game begins.","""Tatort"" ab Hanoverae: O concussa, caput abiit: Furtwängler ludere detectivum accipit. In ""scaena criminis"" ab Hanovera, Commissarius Lindholm venit trans prodigiosum casum: agricola decollatus est - sed caput deest. Excitando INQUISITOR ludum incipit.",2025-10-22 02:01:58+00:00
6218e287e06e8b622f923509cd69be8c,2025-10-26T15:22:48Z,'Hochwasser',www.stern.de,de,0.1,Regimentsappell: Rekruten von Heimatschutzregiment legen Diensteid ab,"Seit einem Jahr gibt es das Heimatschutzregiment 5 der Bundeswehr, dessen Stab im thüringischen Ohrdruf stationiert ist. Es soll vor allem kritische Infrastruktur schützen.",https://www.stern.de/gesellschaft/regional/thueringen/regimentsappell--rekruten-von-heimatschutzregiment-legen-diensteid-ab-36163342.html,https://image.stern.de/36163344/t/29/v1/w1440/r1.7778/-/26--mwr3pm67bwv8axs2048jpeg---78a28b28467c0351.jpg,,"Kopiere den aktuellen Link
Zur Merkliste hinzufügen
Seit einem Jahr gibt es das Heimatschutzregiment 5 der Bundeswehr, dessen Stab im thüringischen Ohrdruf stationiert ist. Es soll vor allem kritis… [+992 chars]",,"Regimentsappell: Rekruten von Heimatschutzregiment legen Diensteid ab. Seit einem Jahr gibt es das Heimatschutzregiment 5 der Bundeswehr, dessen Stab im thüringischen Ohrdruf stationiert ist. Es soll vor allem kritische Infrastruktur schützen.","Regimental roll call: Recruits from the Homeland Security Regiment take an oath of service. The Bundeswehr's Homeland Security Regiment 5 has been in existence for a year now, and its staff is stationed in Ohrdruf, Thuringia. Above all, it is intended to protect critical infrastructure.","Volumen regimentale vocatum: Tirones e Regimento securitatis Patriae iusiurandum servitii accipiunt. Patria Securitatis Regimentum Bundeswehr 5 iam annum exstitit, et baculus eius in Ohrdruf, Thuringia collocatus est. Ante omnia spectat ad criticam structuram tutandam.",2025-10-22 02:01:58+00:00
0cd563b5da3f21acaaeee9ce383ec6b4,2025-10-26T15:22:48Z,'Hochwasser',www.zeit.de,de,0.1,Regimentsappell: Rekruten von Heimatschutzregiment legen Diensteid ab,Hier finden Sie Informationen zu dem Thema „Regimentsappell“. Lesen Sie jetzt „Rekruten von Heimatschutzregiment legen Diensteid ab“.,https://www.zeit.de/news/2025-10/26/rekruten-von-heimatschutzregiment-legen-diensteid-ab,https://img.zeit.de/news/2025-10/26/rekruten-von-heimatschutzregiment-legen-diensteid-ab-image-group/wide__1300x731,,Etwa 160 Rekruten eines Heimatschutzregiments der Bundeswehr haben in Oberhof ihren Diensteid abgelegt. Es handelt sich nach Angaben der Bundeswehr überwiegend um freiwillig Dienende des Heimatschutz… [+804 chars],,Regimentsappell: Rekruten von Heimatschutzregiment legen Diensteid ab. Hier finden Sie Informationen zu dem Thema „Regimentsappell“. Lesen Sie jetzt „Rekruten von Heimatschutzregiment legen Diensteid ab“.,Regimental roll call: Recruits from the Homeland Security Regiment take an oath of service. Here you will find information on the topic of “Regimental Roll Call”. Now read “Homeland Security Regiment Recruits Take Oath of Service”.,"Volumen regimentale vocatum: Tirones e Regimento securitatis Patriae iusiurandum servitii accipiunt. Hic informationes invenies in argumento ""Regimentalis Roll Call"". Nunc legitur ""Iuramentum servitii in patriam Securitatis Regiment Recruite.""",2025-10-22 02:01:58+00:00
