index,published,keyword,domain,language,valid,title,description,url,image,archive,content,quote,de,en,la,added
1f3b57cbe7c2865b23a997abe1ee710a,2025-10-09T18:33:29Z,'Sommer',www.macerkopf.de,de,0.0,WOW erhöht die Preise: Live-Sport und Alles-Paket werden deutlich teurer,"Solltet ihr aktuell darüber nachdenken, den Streaming-Dienst WOW zu abonnieren, so können wir euch nur dringend empfehlen, dies vor dem 13. Oktober tun. Nachdem bereits im Sommer die Preise erhöht wurden, gibt es ab dem genannten Stichtag eine weitere Preiser…",https://www.macerkopf.de/2025/10/09/wow-preise-live-sport-alles/,https://www.macerkopf.de/wp-content/uploads/2022/06/sky_ticket_wow.jpg,,"Solltet ihr aktuell darüber nachdenken, den Streaming-Dienst WOW zu abonnieren, so können wir euch nur dringend empfehlen, dies vor dem 13. Oktober tun. Nachdem bereits im Sommer die Preise erhöht wu… [+1241 chars]",,"WOW erhöht die Preise: Live-Sport und Alles-Paket werden deutlich teurer. Solltet ihr aktuell darüber nachdenken, den Streaming-Dienst WOW zu abonnieren, so können wir euch nur dringend empfehlen, dies vor dem 13. Oktober tun. Nachdem bereits im Sommer die Preise erhöht wurden, gibt es ab dem genannten Stichtag eine weitere Preiser…","WOW increases the prices: Live sports and the everything package become significantly more expensive. If you are currently thinking about subscribing to the WOW streaming service, we can only strongly recommend that you do so before October 13th. After the prices were already increased in the summer, there will be another price increase from the specified date...","LATRO pretia auget: Vivite lusus et omnia sarcina significanter cariora fiunt. Si nunc cogitas de servitio profundo LATRO subscribendo, solum magnopere commendare possumus te id facere ante diem 13 Octobris. Postquam pretia aestate iam aucta sunt, aliud pretium augetur ex statuto tempore...",2025-10-22 02:01:58+00:00
75781d3e86514fce8cadcb75fa283295,2025-10-09T18:42:20Z,'Sommer',www.n-tv.de,de,0.0,Sogar mit Verspätung?: FIFA-Boss Infantino deutet nächste Winter-WM an,"2034 findet die WM in Saudi-Arabien statt - möglicherweise aber auch erst 2035. FIFA-Boss Gianni Infantino denkt offen darüber nach, etwas am Kalender herumzuwerkeln. Denn neben dem Wetter spielt bei der Terminplanung auch Religion eine Rolle.",https://www.n-tv.de/sport/fussball/FIFA-Boss-Infantino-deutet-naechste-Winter-WM-an-article26086688.html,https://www.n-tv.de/img/incoming/crop26086687/5351326769-cImg_16_9-w1200/551694962.jpg,,"2034 findet die WM in Saudi-Arabien statt - möglicherweise aber auch erst 2035. FIFA-Boss Gianni Infantino denkt offen darüber nach, etwas am Kalender herumzuwerkeln. Denn neben dem Wetter spielt bei… [+1551 chars]",,"Sogar mit Verspätung?: FIFA-Boss Infantino deutet nächste Winter-WM an. 2034 findet die WM in Saudi-Arabien statt - möglicherweise aber auch erst 2035. FIFA-Boss Gianni Infantino denkt offen darüber nach, etwas am Kalender herumzuwerkeln. Denn neben dem Wetter spielt bei der Terminplanung auch Religion eine Rolle.","Even late?: FIFA boss Infantino hints at the next Winter World Cup. The World Cup will take place in Saudi Arabia in 2034 - but possibly not until 2035. FIFA boss Gianni Infantino is openly thinking about tinkering with the calendar. In addition to the weather, religion also plays a role in scheduling.","Etiam sero?: FIFA bulla Infantino innuit ad proximum Trophaeum Mundi hiemalis. Trophaeum Mundi in Arabia Saudiana anno 2034 fient, sed fortasse non usque ad 2035. FIFA bulla Gianni Infantino palam cogitat de tinkeribus cum calendario. Praeter tempestatem, religio etiam in scheduling agit.",2025-10-22 02:01:58+00:00
a119906caf9f650af4d5188491f201f0,2025-10-09T18:57:42Z,'Frühling',www.faz.net,de,0.0,Australische Magpies: Sie greifen meist von hinten an,In Sydney ist Frühling – und damit beginnt auch die Brutsaison der „australischen Elstern“. Einige werden verteidigen die Umgebung ihres Nestes aggressiv. Die Australier wehren sich mit kreativen Mitteln.,https://www.faz.net/aktuell/gesellschaft/tiere/elstern-attacken-in-sydney-110724214.html,https://media1.faz.net/ppmedia/w1200/aktuell/gesellschaft/3892930109/1.10724213/facebook_teaser/er-nimmt-s-gelassen-shane.jpg.webp,,Selbst in der Millionenstadt Sydney ­häufen sich wieder die Attacken: Die ­Elstern greifen an! Die Australian Magpies (Flötenkrähenstare) haben schon oft für Aufsehen gesorgt. Obwohl sie nicht mit ­u… [+1916 chars],,Australische Magpies: Sie greifen meist von hinten an. In Sydney ist Frühling – und damit beginnt auch die Brutsaison der „australischen Elstern“. Einige werden verteidigen die Umgebung ihres Nestes aggressiv. Die Australier wehren sich mit kreativen Mitteln.,"Australian Magpies: They usually attack from behind. It's spring in Sydney - and with it the breeding season of the ""Australian magpies"" begins. Some will aggressively defend the area around their nest. The Australians are fighting back with creative means.","Australian Magpies: Solent a tergo oppugnare. Ver in Sydneyum - et cum eo fetum ""Picae Australiae"" incipit. Quidam infensi circum nidum suum defendent. Australiani pugnant cum mediis effectivis.",2025-10-22 02:01:58+00:00
984f3e3542e60cfcde56358bd74edf6e,2025-10-10T09:29:43Z,'Ernte',www.n-tv.de,de,0.0,Nach schwachem Vorjahr: Deutsche Weinbauern erwarten deutliches Ernteplus,Nach Spätfrost und Regen im vergangenen Jahr kehrt bei den Winzern etwas Zuversicht zurück: Die Weinernte in Deutschland fällt 2025 wieder besser aus - die Erholung ist aber nicht in allen Regionen gleich zu spüren. In den größten Anbaugebieten herrscht diese…,https://www.n-tv.de/wirtschaft/Nach-sehr-schwachem-Vorjahr-Weinernte-in-Deutschland-faellt-wieder-besser-aus-article26087427.html,https://www.n-tv.de/img/incoming/crop26087416/95213276-cImg_16_9-w1200/548623136.jpg,,Nach Spätfrost und Regen im vergangenen Jahr kehrt bei den Winzern etwas Zuversicht zurück: Die Weinernte in Deutschland fällt 2025 wieder besser aus - die Erholung ist aber nicht in allen Regionen g… [+1889 chars],,Nach schwachem Vorjahr: Deutsche Weinbauern erwarten deutliches Ernteplus. Nach Spätfrost und Regen im vergangenen Jahr kehrt bei den Winzern etwas Zuversicht zurück: Die Weinernte in Deutschland fällt 2025 wieder besser aus - die Erholung ist aber nicht in allen Regionen gleich zu spüren. In den größten Anbaugebieten herrscht diese…,"After a weak previous year: German winegrowers expect a significant increase in harvest. After late frost and rain last year, some confidence is returning among winemakers: the wine harvest in Germany will be better again in 2025 - but the recovery is not being felt equally in all regions. In the largest growing areas, this…","Post annum debile: Germani vinitores insignes messes exspectant. Post sero gelu et pluviis anno praeterito aliqua fiducia revertitur inter vinolatores: messis vinariae in Germania iterum anno 2025 melior erit - sed recuperatio in omnibus regionibus aequaliter non sentitur. In amplissimis locis nascentibus, hoc…",2025-10-22 02:01:58+00:00
ca973f17f066c99bb78e408c9cc3195c,2025-10-10T10:38:48Z,'Erle',www.bild.de,de,0.0,Gelsenkirchen - Mann (23) wehrt Raubüberfall im Park ab,In Gelsenkirchen wurde ein Mann (23) bei einem versuchten Raub im Park an der Adenauerallee verletzt. Die Täter flüchteten ohne Beute.,https://www.bild.de/regional/ruhrgebiet/gelsenkirchen-angriff-im-park-an-der-adenauerallee-68e8e1ecd212ab5081d5746d,"https://images.bild.de/68e8e1ecd212ab5081d5746d/e601f8b1c3e14dc38049f1094039b605,802410b5?w=1280",,"Gelsenkirchen Ein 23-Jähriger wurde am Abend des 09.10.2025 gegen 22.30 Uhr in einem Park an der Adenauerallee in Erle von zwei Unbekannten angegriffen.
Die Täter versuchten, ihm seine Umhängetasche… [+648 chars]",,Gelsenkirchen - Mann (23) wehrt Raubüberfall im Park ab. In Gelsenkirchen wurde ein Mann (23) bei einem versuchten Raub im Park an der Adenauerallee verletzt. Die Täter flüchteten ohne Beute.,"Gelsenkirchen - Man (23) fends off robbery in the park. In Gelsenkirchen, a man (23) was injured in an attempted robbery in the park on Adenauerallee. The perpetrators fled without loot.","Gelsenkirchen - homo (23) rapinam in hortis arcet. In Gelsenkirchen, homo (23) latrocinii incepti in hortis super Adenauerallee vulneratus est. Sine praeda facinoris fugiunt.",2025-10-22 02:01:58+00:00
2d450d132534fc33060e69aefa8a012e,2025-10-10T12:51:41Z,'Ernte',tirol.orf.at,de,0.0,2025 war gutes Erntejahr für Tirols Bauern,Das Erntejahr 2025 ist nach Angaben der Tiroler Landwirtschaftskammer insgesamt gut  verlaufen. Herausfordernd seien die Wetterkapriolen und der regnerische Juli gewesen. Weniger zufriedenstellend fiel der Absatz von Gemüseprodukten aus. Dieser sank unter and…,https://tirol.orf.at/stories/3325328/,https://ibs.orf.at/tir?image=https%3A%2F%2Foekastatic.orf.at%2Fmims%2F2024%2F20%2F92%2Fcrops%2Fw%3D1200%2Ch%3D627%2Cq%3D75%2F2207737_master_837392_klima_landwirtschaft_71_vik.jpg%3Fs%3D025578e5669f0319f4ddac440598a5b27cc6421a,,Neben den verstärkten Importen seien ein generell verändertes Konsumverhalten sowie durch die aktuelle Preis- und Mehrwertsteuerdiskussion verursachte Unsicherheiten weitere Gründe für den geringeren… [+2729 chars],,2025 war gutes Erntejahr für Tirols Bauern. Das Erntejahr 2025 ist nach Angaben der Tiroler Landwirtschaftskammer insgesamt gut  verlaufen. Herausfordernd seien die Wetterkapriolen und der regnerische Juli gewesen. Weniger zufriedenstellend fiel der Absatz von Gemüseprodukten aus. Dieser sank unter and…,"2025 was a good harvest year for Tyrol's farmers. According to the Tyrolean Chamber of Agriculture, the 2025 harvest year went well overall. The capricious weather and the rainy July were challenging. Sales of vegetable products were less satisfactory. This sank among other…","2025 annus messis bonae pro agricolis Tirolis fuit. Secundum cubiculum Raetici agriculturae, anno MMXXV messis bene altiore processit. Tempestas levis et pluviae Iulio provocabant. Sales productorum vegetabilium minus satisfaciunt. Hoc inter alia mersa…",2025-10-22 02:01:58+00:00
97f14a550068945de133fdf7d2f8347b,2025-10-10T13:40:33Z,'Hochwasser',www.zeit.de,de,0.0,Gewässer: Hochwasserschutz: Schwarze Elster soll mehr Platz bekommen,Hier finden Sie Informationen zu dem Thema „Gewässer“. Lesen Sie jetzt „Hochwasserschutz: Schwarze Elster soll mehr Platz bekommen“.,https://www.zeit.de/news/2025-10/10/hochwasserschutz-schwarze-elster-soll-mehr-platz-bekommen,https://img.zeit.de/news/2025-10/10/hochwasserschutz-schwarze-elster-soll-mehr-platz-bekommen-image-group/wide__1300x731,,Die Schwarze Elster ist ein Sorgenkind unter den Flüssen in Brandenburg. Das Umweltministerium will nun Verbesserungen beim Hochwasserschutz an dem stark ausgebauten und begradigten Fluss voranbringe… [+1225 chars],,Gewässer: Hochwasserschutz: Schwarze Elster soll mehr Platz bekommen. Hier finden Sie Informationen zu dem Thema „Gewässer“. Lesen Sie jetzt „Hochwasserschutz: Schwarze Elster soll mehr Platz bekommen“.,Waters: Flood protection: Black Elster should be given more space. Here you will find information on the topic of “water bodies”. Now read “Flood protection: Black Elster should get more space”.,"Aquae: Diluvium praesidium: Niger Elster plus spatii daretur. Hic informationes invenies in argumento ""corporum aquarum"". Nunc lego ""diluvium praesidium: Black Elster plus spatii debet"".",2025-10-22 02:01:58+00:00
30b2268e8854495f638f8ba27776d71d,2025-10-10T13:40:33Z,'Hochwasser',www.stern.de,de,0.0,Gewässer: Hochwasserschutz: Schwarze Elster soll mehr Platz bekommen,Plessa/Bad Liebenwerda (bb) - Die Schwarze Elster ist ein Sorgenkind unter den Flüssen in Brandenburg. Das Umweltministerium will nun Verbesserungen beim,https://www.stern.de/gesellschaft/regional/berlin-brandenburg/gewaesser--hochwasserschutz--schwarze-elster-soll-mehr-platz-bekommen-36121942.html,https://image.stern.de/36121944/t/Uv/v1/w1440/r1.7778/-/10--o4qqslzsebv8axs2048jpeg---4d4eb8260933e3f4.jpg,,"Kopiere den aktuellen Link
Zur Merkliste hinzufügen
Der Hochwasserschutz soll durch neue Überflutungsflächen und verlegte Deiche besser werden. Auch bräunlicher Eisenschlamm muss raus aus dem Fluss… [+1387 chars]",,Gewässer: Hochwasserschutz: Schwarze Elster soll mehr Platz bekommen. Plessa/Bad Liebenwerda (bb) - Die Schwarze Elster ist ein Sorgenkind unter den Flüssen in Brandenburg. Das Umweltministerium will nun Verbesserungen beim,Waters: Flood protection: Black Elster should be given more space. Plessa/Bad Liebenwerda (bb) - The Black Elster is a problem child among the rivers in Brandenburg. The Ministry of the Environment now wants improvements,Aquae: Diluvium praesidium: Niger Elster plus spatii daretur. Plessa/Malum Liebenwerda (bb) - The Black Elster queritur puer inter fluvios Brandenburgenses. Ministerium Environmenti nunc emendationes vult,2025-10-22 02:01:58+00:00
fe6f01f7ee80eb0fa4ac8f468f0dec4c,2025-10-10T13:41:33Z,'Hochwasser',www.tagesspiegel.de,de,0.0,Gewässer: Hochwasserschutz: Schwarze Elster soll mehr Platz bekommen,Der Hochwasserschutz soll durch neue Überflutungsflächen und verlegte Deiche besser werden. Auch bräunlicher Eisenschlamm muss raus aus dem Fluss.,https://www.tagesspiegel.de/berlin/gewasser-hochwasserschutz-schwarze-elster-soll-mehr-platz-bekommen-14533781.html,https://www.tagesspiegel.de/images/14533778/alternates/BASE_16_9_W1400/1760103693000/deichpflege-schwarze-elster.jpeg,,Die Schwarze Elster ist ein Sorgenkind unter den Flüssen in Brandenburg. Das Umweltministerium will nun Verbesserungen beim Hochwasserschutz an dem stark ausgebauten und begradigten Fluss voranbringe… [+1279 chars],,Gewässer: Hochwasserschutz: Schwarze Elster soll mehr Platz bekommen. Der Hochwasserschutz soll durch neue Überflutungsflächen und verlegte Deiche besser werden. Auch bräunlicher Eisenschlamm muss raus aus dem Fluss.,Waters: Flood protection: Black Elster should be given more space. Flood protection should be improved through new flood areas and relocated dikes. Brownish iron sludge also has to be removed from the river.,Aquae: Diluvium praesidium: Niger Elster plus spatii daretur. Tutela diluvii novis locis diluvii emendanda sunt et fossata collocaverunt. Pituita etiam ferri fusca a flumine removenda est.,2025-10-22 02:01:58+00:00
9b6b63f41d066ec98a90118c7eae1917,2025-10-10T14:13:39Z,'Schnee',www.faz.net,de,0.0,Unerwarteter Schneesturm: Sie wollten auf dem Everest wandern – und flohen am Ende vor dem Tod,Hunderte eingeschneite Bergwanderer mussten vergangene Woche am Mount Everest gerettet werden. Auch der Bergführer Wu Ji war mit einer Gruppe unterwegs – und berichtet von dramatischen Szenen.,https://www.faz.net/aktuell/gesellschaft/ungluecke/eingeschneit-am-everest-ein-bergfuehrer-berichtet-110726365.html,https://media0.faz.net/ppmedia/w1200/aktuell/3332326035/1.10726360/facebook_teaser/schneesturm-statt-blick-auf.jpg.webp,,"Es war zwei Uhr nachts im Himalaja, und auf fünftausend Meter Höhe wurde der Schneefall immer heftiger. Die ersten Tage unserer Tour nieselte es, aber plötzlich hatte es einen ganzen Tag und die Nach… [+6049 chars]",,Unerwarteter Schneesturm: Sie wollten auf dem Everest wandern – und flohen am Ende vor dem Tod. Hunderte eingeschneite Bergwanderer mussten vergangene Woche am Mount Everest gerettet werden. Auch der Bergführer Wu Ji war mit einer Gruppe unterwegs – und berichtet von dramatischen Szenen.,Unexpected snowstorm: They wanted to hike Everest - and ended up fleeing death. Hundreds of snow-covered mountain hikers had to be rescued on Mount Everest last week. The mountain guide Wu Ji was also with a group - and reported dramatic scenes.,Inopinatus nivis: Everest hike volebant - Et mortem fugiens finivit. Centum hikeri montis nivis operti in Monte Everest hebdomade proxima eripi debent. Mons dux Wu Ji erat etiam cum grege - et nuntiavit scenas scenicas.,2025-10-22 02:01:58+00:00
b95a49338e9c871ce4cd40ee8ac28a76,2025-10-11T02:26:06Z,'Ernte',www.stern.de,de,0.0,Fleißige Insekten: Imker bereiten Bienen auf Winter vor,Kirchhain (lhe) - Nach einer überdurchschnittlichen Honigernte in diesem Jahr bereiten die Imker ihre Bienen auf die kalte Jahreszeit vor. «Die Völker,https://www.stern.de/gesellschaft/regional/hessen/fleissige-insekten--imker-bereiten-bienen-auf-winter-vor-36122786.html,https://image.stern.de/36122788/t/z6/v1/w1440/r1.7778/-/11--36w3ywzntkv6axs2048jpeg---80ed00e4daf71be1.jpg,,"Kopiere den aktuellen Link
Zur Merkliste hinzufügen
Die Ernte ist geschafft, für Honigbienen geht es in die Pause. Damit sie gut durch die kalte Jahreszeit kommen, sind noch einige Maßnahmen nötig.… [+1487 chars]",,Fleißige Insekten: Imker bereiten Bienen auf Winter vor. Kirchhain (lhe) - Nach einer überdurchschnittlichen Honigernte in diesem Jahr bereiten die Imker ihre Bienen auf die kalte Jahreszeit vor. «Die Völker,"Busy insects: Beekeepers prepare bees for winter. Kirchhain (lhe) - After an above-average honey harvest this year, beekeepers are preparing their bees for the cold season. «The peoples","Occupantur insecta: Apes apibus ad hiemem parant. Kirchhain (Lhe) - Post supra-medium mel messis hoc anno, apibus apes pro tempore frigoris parant. « populi",2025-10-22 02:01:58+00:00
35337049481fa721ba5dbd500febbb95,2025-10-11T02:26:06Z,'Winter',www.zeit.de,de,0.0,Fleißige Insekten: Imker bereiten Bienen auf Winter vor,Hier finden Sie Informationen zu dem Thema „Fleißige Insekten“. Lesen Sie jetzt „Imker bereiten Bienen auf Winter vor“.,https://www.zeit.de/news/2025-10/11/imker-bereiten-bienen-auf-winter-vor,https://img.zeit.de/news/2025-10/11/imker-bereiten-bienen-auf-winter-vor-image-group/wide__1300x731,,"Nach einer überdurchschnittlichen Honigernte in diesem Jahr bereiten die Imker ihre Bienen auf die kalte Jahreszeit vor. «Die Völker sollen möglichst stark und gut versorgt in den Winter gehen», erlä… [+1326 chars]",,Fleißige Insekten: Imker bereiten Bienen auf Winter vor. Hier finden Sie Informationen zu dem Thema „Fleißige Insekten“. Lesen Sie jetzt „Imker bereiten Bienen auf Winter vor“.,Busy insects: Beekeepers prepare bees for winter. Here you will find information on the topic of “busy insects”. Read “Beekeepers prepare bees for winter” now.,"Occupantur insecta: Apes apibus ad hiemem parant. Hic informationes invenies in argumento ""actorum insectorum"". Lege ""Medicinum apibus ad hiemem parant"" nunc.",2025-10-22 02:01:58+00:00
915a2cbf018b08eb135d4c14907c2127,2025-10-11T03:30:06Z,'Hochwasser',www.stern.de,de,0.0,Ad-hoc-Programm: Kommunen fordern mehr Geld für Katastrophenschutz,"Waldbrände, Hochwasser, Cyberangriffe: Die Herausforderungen für den Katastrophenschutz sind vielfältig. Niedersachsen werde daher weiter investieren, sichert Ministerin Behrens zu.",https://www.stern.de/gesellschaft/regional/niedersachsen-bremen/ad-hoc-programm--kommunen-fordern-mehr-geld-fuer-katastrophenschutz-36122838.html,https://image.stern.de/36122840/t/KH/v1/w1440/r1.7778/-/11--rsgdxuhisov4axs2048jpeg---f2f94ce10479cee1.jpg,,"Kopiere den aktuellen Link
Zur Merkliste hinzufügen
Waldbrände, Hochwasser, Cyberangriffe: Die Herausforderungen für den Katastrophenschutz sind vielfältig. Niedersachsen werde daher weiter investi… [+2310 chars]",,"Ad-hoc-Programm: Kommunen fordern mehr Geld für Katastrophenschutz. Waldbrände, Hochwasser, Cyberangriffe: Die Herausforderungen für den Katastrophenschutz sind vielfältig. Niedersachsen werde daher weiter investieren, sichert Ministerin Behrens zu.","Ad hoc program: Municipalities are demanding more money for disaster protection. Forest fires, floods, cyber attacks: the challenges for disaster protection are diverse. Lower Saxony will therefore continue to invest, assures Minister Behrens.","Ad hoc programma: Municipia plus pecuniae pro calamitate praesidium exigunt. Silvarum incendia, diluvia, impetus cyber: diversae sunt tutelae calamitatis provocationes. Saxoniae inferioris igitur minister Behrens obsidere pergit et confirmat.",2025-10-22 02:01:58+00:00
9e6868ff8d1be11c4ed94fa02d535173,2025-10-11T05:56:48Z,'Herbst',www.zeit.de,de,0.0,Neue Apple Watches: Das ist die richtige Apple Watch für Sie,Drei neue Uhren hat Apple im Herbst herausgebracht. Nach drei Wochen Test ist klar: Die teuerste ist nicht unbedingt die beste.,https://www.zeit.de/digital/mobil/2025-10/neu-apple-watches-series-11-se3-ultra-3-preis-leistung-funktionalitaet-test,https://img.zeit.de/digital/2025-10/neu-apple-watch-series-11-se3-ultra-3-preis-leistung-funktionalitaet-test-bild/wide__1300x731,,"Nachrichten
aufs Handgelenk bekommen, navigieren, das Smartphone steuern, Gesundheitsdaten
messen: Das sind die Hauptgründe, weswegen sich Menschen in Deutschland eine
Smartwatch zulegen. Das sagt… [+602 chars]",,Neue Apple Watches: Das ist die richtige Apple Watch für Sie. Drei neue Uhren hat Apple im Herbst herausgebracht. Nach drei Wochen Test ist klar: Die teuerste ist nicht unbedingt die beste.,New Apple Watches: This is the right Apple Watch for you. Apple released three new watches this fall. After three weeks of testing it is clear: the most expensive is not necessarily the best.,Novum Apple Vigilo: Hoc est ius Apple Vigilate pro vobis. Lacus tres vigilias novas hoc casu dimisit. Post tres septimanas patet probatio: optimum necessario est carissimum.,2025-10-22 02:01:58+00:00
d26b2be5e4aeacd996bcd70545d31807,2025-10-11T07:38:02Z,'Gewitter',www.ibiza-heute.de,de,0.0,"Ibiza & Formentera: Wetter – heftiger Samstag, ruhiger Sonntag!","So sieht die Wetter-Situation am Samstag, 9.25 Uhr, auf dem Gewitter-Radar aus. Eine heftige Gewitterzelle steht zwischen Ibiza und Mallorca. Die Ausläufer erreichen aber immer wieder unsere Inseln. Quelle von IbizaHEUTE: Windy.com Liebe Leser, wir auf Ibiza …",https://www.ibiza-heute.de/ibiza-formentera-wetter-heftiger-samstag-ruhiger-sonntag/,https://www.ibiza-heute.de/wp-content/uploads/2025/10/Bildschirmfoto-2025-10-11-um-09.26.53.jpg,,"So sieht die Wetter-Situation am Samstag, 9.25 Uhr, auf dem Gewitter-Radar aus. Eine heftige Gewitterzelle steht zwischen Ibiza und Mallorca. Die Ausläufer erreichen aber immer wieder unsere Inseln. … [+1162 chars]",,"Ibiza & Formentera: Wetter – heftiger Samstag, ruhiger Sonntag!. So sieht die Wetter-Situation am Samstag, 9.25 Uhr, auf dem Gewitter-Radar aus. Eine heftige Gewitterzelle steht zwischen Ibiza und Mallorca. Die Ausläufer erreichen aber immer wieder unsere Inseln. Quelle von IbizaHEUTE: Windy.com Liebe Leser, wir auf Ibiza …","Ibiza & Formentera: Weather – violent Saturday, calm Sunday!. This is what the weather situation looks like on Saturday at 9:25 a.m. on the thunderstorm radar. There is a violent thunderstorm cell between Ibiza and Mallorca. But the foothills always reach our islands. Source from IbizaTODAY: Windy.com Dear readers, we in Ibiza...","Ibiza & Formentera: Tempestas - Saturni vehemens, tranquillitas Solis!. Haec condicio tempestatis spectat ut die Sabbati in die Sabbati 9:25 a.m. in tonitribus radar. Inter Ibizam et Mallorcam cellae vehementis tonitribusque gignuntur. Sed crepidines insulas nostras semper attingunt. Source from IbizaTODAY: Windy.com Carissimi lectores, nos in Ibiza...",2025-10-22 02:01:58+00:00
3da350206322b80122b226d4b140547c,2025-10-11T09:12:15Z,'Herbst',www.zeit.de,de,0.0,Vorhersage: Ruhiges Herbstwetter unter grauem Himmel,Hier finden Sie Informationen zu dem Thema „Vorhersage“. Lesen Sie jetzt „Ruhiges Herbstwetter unter grauem Himmel“.,https://www.zeit.de/news/2025-10/11/ruhiges-herbstwetter-unter-grauem-himmel,https://img.zeit.de/news/2025-10/11/ruhiges-herbstwetter-unter-grauem-himmel-image-group/wide__1300x731,,"Nach dem verregneten Sommer bleibt auch der Herbst in Bayern vorerst eher grau und trüb. An diesem Wochenende gelangt am Rande eines Hochs über den britischen Inseln relativ milde Luft nach Bayern, w… [+461 chars]",,Vorhersage: Ruhiges Herbstwetter unter grauem Himmel. Hier finden Sie Informationen zu dem Thema „Vorhersage“. Lesen Sie jetzt „Ruhiges Herbstwetter unter grauem Himmel“.,Forecast: Calm autumn weather under gray skies. Here you will find information on the topic of “prediction”. Read “Quiet autumn weather under a gray sky” now.,"Praedictio: Serena autumni serenitas sub caelo sereno. Hic informationes invenies in argumento ""praedictionis"". Lege ""Quieta autumni tempestas sub caelo cinereo"" nunc.",2025-10-22 02:01:58+00:00
