index,published,keyword,domain,language,valid,title,description,url,image,archive,content,quote,de,en,la,added
ca2ae7ff8de4e1788d2d0de37b25a609,2025-10-01T04:50:31Z,'Herbst',www.welt.de,de,0.0,„Hausaufgabe: täglich einen sauberen Ziegelstein mitbringen“,Neben vielem anderem hatte der Nationalsozialismus auch das deutsche Bildungswesen ruiniert. Im Herbst 1945 stand der Neustart an – doch die Probleme war so vielfältig wie herausfordernd.,https://www.welt.de/geschichte/article68d247246199625f8c0fa0f8/neustart-der-schulen-1945-taeglich-einen-sauberen-ziegelstein-mitbringen.html,https://images.welt.de/68d247246199625f8c0fa0f8/1d2c82efb0ab67145dc73c66c909f097/ci16x9-w1200/german-re-education,,Neben vielem anderem hatte der Nationalsozialismus auch das deutsche Bildungswesen ruiniert. Im Herbst 1945 stand der Neustart an doch die Probleme war so vielfältig wie herausfordernd.Bildung tat No… [+8199 chars],,„Hausaufgabe: täglich einen sauberen Ziegelstein mitbringen“. Neben vielem anderem hatte der Nationalsozialismus auch das deutsche Bildungswesen ruiniert. Im Herbst 1945 stand der Neustart an – doch die Probleme war so vielfältig wie herausfordernd.,"“Homework: bring a clean brick every day.” Among many other things, National Socialism also ruined the German education system. In the fall of 1945 the restart was imminent - but the problems were as varied as they were challenging.","""Duis: da laterem puram cotidie."" Inter multa alia, Socialismus nationalis etiam systema educationis Germanicae pessum dedit. In casu anni 1945 sileo imminebat - sed problemata tam varia erant quam provocantia.",2025-10-22 02:01:58+00:00
8c30dc373fe2dc72c27a0fba35969bcc,2025-10-01T04:57:00Z,'Aussaat',www.stern.de,de,0.0,"Pflanzen, pflegen, ernten: Feldsalat anbauen: Das sind die wichtigsten Schritte","Das aus dem gleichnamigen Märchen bekannte Blattgemüse enthält viele gesunde Vitamine und Mineralstoffe. Wer Rapunzel selbst anbauen möchte, muss nur wenige Schritte beachten.",https://www.stern.de/familie/feldsalat-im-herbst-anbauen--so-ernten-sie-frischen-rapunzel-35693626.html,https://image.stern.de/35693628/t/9L/v2/w1440/r1.7778/-/feldsalat-anbauen.jpg,,"Kopiere den aktuellen Link
Zur Merkliste hinzufügen
Das aus dem gleichnamigen Märchen bekannte Blattgemüse enthält viele gesunde Vitamine und Mineralstoffe. Wer Rapunzel selbst anbauen möchte, muss… [+4567 chars]",,"Pflanzen, pflegen, ernten: Feldsalat anbauen: Das sind die wichtigsten Schritte. Das aus dem gleichnamigen Märchen bekannte Blattgemüse enthält viele gesunde Vitamine und Mineralstoffe. Wer Rapunzel selbst anbauen möchte, muss nur wenige Schritte beachten.","Planting, caring for, harvesting: Growing lamb's lettuce: These are the most important steps. The leafy vegetables known from the fairy tale of the same name contain many healthy vitamins and minerals. If you want to grow Rapunzel yourself, you only need to follow a few steps.","Plantatio, curans, metis: Crescens lactuca agni: Haec sunt praecipua vestigia. Folia olera ex notissima fabula eiusdem nominis multa vitamins et mineralia sana continent. Si rapunzel te crescere vis, paucis tantum gradibus sequi debes.",2025-10-22 02:01:58+00:00
2ac8aa274effe9cd43cf214aecdcc2f0,2025-10-01T05:43:21Z,'Schnee',www.kino-zeit.de,de,0.0,Dead of Winter – Eisige Stille (2025),"Locarno 2025

 

 
 




 
 LEONINE Distribution GmbH

 
 Dead of Winter – Eisige Stille (2025) von Brian Kirk

 
 



Trotz Emma Thompson bleibt’s frostig
Emma Thompson wurde beim diesjährigen Locarno Filmfestival mit dem Leopard Club Award geehrt. Ein ve…",https://www.kino-zeit.de/film-kritiken-trailer/dead-of-winter-eisige-stille-2025,,,"Doch die Euphorie hielt nicht lange an. Denn ausgerechnet der im Anschluss gezeigte Film The Dead of Winter, in dem Thompson nicht nur die Hauptrolle spielt, sondern auch als Produzentin beteiligt is… [+4076 chars]",,"Dead of Winter – Eisige Stille (2025). Locarno 2025

 

 
 




 
 LEONINE Distribution GmbH

 
 Dead of Winter – Eisige Stille (2025) von Brian Kirk

 
 



Trotz Emma Thompson bleibt’s frostig
Emma Thompson wurde beim diesjährigen Locarno Filmfestival mit dem Leopard Club Award geehrt. Ein ve…","Dead of Winter – Icy Silence (2025). Locarno 2025

 

 
 




 
 LEONINE Distribution GmbH

 
 Dead of Winter – Icy Silence (2025) by Brian Kirk

 
 



Despite Emma Thompson, things remain frosty
Emma Thompson was honored with the Leopard Club Award at this year's Locarno Film Festival. A…","Hiems mortuus - Silentium Glacialis (2025). Locarno 2025

 

 
 




 
 LEONINE Distribution GmbH

 
 Hiems mortuus - Silentium Glacialis (2025) by Brian Kirk

 
 



Quamvis Emma Thompson, res manent gelidae
Emma Thompson honoratus est cum Leopardo Club Award in hoc anno Festum cinematographicum Locarno. A…",2025-10-22 02:01:58+00:00
827a861edd731797e27ecadcd0aff462,2025-10-01T07:00:08Z,'Winter',www.zeit.de,de,0.0,"Klimawandel: Wenig Schnee, viel Hitze: Gletscher schrumpfen weiter","Hier finden Sie Informationen zu dem Thema „Klimawandel“. Lesen Sie jetzt „Wenig Schnee, viel Hitze: Gletscher schrumpfen weiter“.",https://www.zeit.de/news/2025-10/01/wenig-schnee-viel-hitze-gletscher-schrumpfen-weiter,https://img.zeit.de/news/2025-10/01/wenig-schnee-viel-hitze-gletscher-schrumpfen-weiter-image-group/wide__1300x731,,"Es gibt keine Verschnaufpause für die Schweizer Gletscher: in diesem Jahr wurde bei ihnen der viertgrößte Schwund seit Messbeginn 1950 erfasst. Ihr Volumen ging um drei Prozent zurück, wie das Gletsc… [+2221 chars]",,"Klimawandel: Wenig Schnee, viel Hitze: Gletscher schrumpfen weiter. Hier finden Sie Informationen zu dem Thema „Klimawandel“. Lesen Sie jetzt „Wenig Schnee, viel Hitze: Gletscher schrumpfen weiter“.","Climate change: Little snow, lots of heat: glaciers continue to shrink. Here you will find information on the topic of “climate change”. Now read “Little snow, lots of heat: glaciers continue to shrink”.","Mutatio climatis: Parva nix, multae caloris: molibus pergunt horrere. Hic informationes invenies in argumento ""mutationis climatis"". Nunc lege ""Nivem, multam caloris: molibus pergere horrere"".",2025-10-22 02:01:58+00:00
a3c3e8e2ac0c062bd40ea9224d858a1f,2025-10-01T07:00:08Z,'Schnee',www.stern.de,de,0.0,"Klimawandel: Wenig Schnee, viel Hitze: Gletscher schrumpfen weiter",Gletscherschwund im Rekordtempo: Warum ein schneearmer Winter und Hitzewellen das Schweizer Gebirge gefährlicher machen – und was das für Alpendörfer wie Blatten bedeutet.,https://www.stern.de/panorama/wissen/klimawandel--wenig-schnee--viel-hitze--gletscher-schrumpfen-weiter-36096194.html,https://image.stern.de/36096196/t/7i/v1/w1440/r1.7778/-/01--ltv75aqgwuv3axs2048jpeg---6fc7ab2906a8b0e0.jpg,,"Kopiere den aktuellen Link
Zur Merkliste hinzufügen
Gletscherschwund im Rekordtempo: Warum ein schneearmer Winter und Hitzewellen das Schweizer Gebirge gefährlicher machen und was das für Alpendörf… [+2406 chars]",,"Klimawandel: Wenig Schnee, viel Hitze: Gletscher schrumpfen weiter. Gletscherschwund im Rekordtempo: Warum ein schneearmer Winter und Hitzewellen das Schweizer Gebirge gefährlicher machen – und was das für Alpendörfer wie Blatten bedeutet.","Climate change: Little snow, lots of heat: glaciers continue to shrink. Glaciers are shrinking at a record pace: Why a winter with little snow and heat waves make the Swiss mountains more dangerous - and what that means for Alpine villages like Blatten.","Mutatio climatis: Parva nix, multae caloris: molibus pergunt horrere. Glaciers in a commentariis gressum recusant: Cur hiems cum parvis nivis et aestu fluctibus montes Helvetiae periculosior est - et quid id significat ad Alpinas villas sicut Blatten.",2025-10-22 02:01:58+00:00
e1bb6e754f75809f92a80a6c4ef997f8,2025-10-01T07:01:41Z,'Winter',www.tagesspiegel.de,de,0.0,"Klimawandel: Wenig Schnee, viel Hitze: Gletscher schrumpfen weiter",Gletscherschwund im Rekordtempo: Warum ein schneearmer Winter und Hitzewellen das Schweizer Gebirge gefährlicher machen – und was das für Alpendörfer wie Blatten bedeutet.,https://www.tagesspiegel.de/wissen/klimawandel-wenig-schnee-viel-hitze-gletscher-schrumpfen-weiter-14434421.html,https://www.tagesspiegel.de/images/14434418/alternates/BASE_16_9_W1400/1759302100000/rhonegletscher-in-der-schweiz.jpeg,,"Es gibt keine Verschnaufpause für die Schweizer Gletscher: in diesem Jahr wurde bei ihnen der viertgrößte Schwund seit Messbeginn 1950 erfasst. Ihr Volumen ging um drei Prozent zurück, wie das Gletsc… [+2273 chars]",,"Klimawandel: Wenig Schnee, viel Hitze: Gletscher schrumpfen weiter. Gletscherschwund im Rekordtempo: Warum ein schneearmer Winter und Hitzewellen das Schweizer Gebirge gefährlicher machen – und was das für Alpendörfer wie Blatten bedeutet.","Climate change: Little snow, lots of heat: glaciers continue to shrink. Glaciers are shrinking at a record pace: Why a winter with little snow and heat waves make the Swiss mountains more dangerous - and what that means for Alpine villages like Blatten.","Mutatio climatis: Parva nix, multae caloris: molibus pergunt horrere. Glaciers in a commentariis gressum recusant: Cur hiems cum parvis nivis et aestu fluctibus montes Helvetiae periculosior est - et quid id significat ad Alpinas villas sicut Blatten.",2025-10-22 02:01:58+00:00
07f5c4fa08115bb54d2f5e590549d60f,2025-10-01T08:02:38Z,'Winter',www.focus.de,de,0.0,Die weißen Riesen zerfallen: Experten warnen vor dramatischem Gletscher-Sterben,Gletscherschwund im Rekordtempo: Warum ein schneearmer Winter und Hitzewellen das Schweizer Gebirge gefährlicher machen – und was das für Alpendörfer wie Blatten bedeutet.,https://www.focus.de/wissen/die-weissen-riesen-zerfallen-experten-warnen-vor-dramatischem-gletscher-sterben_b29a8723-ef5d-4259-ab8d-0fbb9a9b7e18.html,https://quadro.burda-forward.de/ctf/635a8850-7385-4e6b-837c-b129bfd2e04d.2f7ad36e-1965-4e7e-86de-7ebec6a92038.jpeg?im=RegionOfInterestCrop%3D%281200%2C630%29%2CregionOfInterest%3D%28993%2C757%29&hash=440fddd9a8091696f58fce5664e896c255c168a36659d71815b8185026d6aa2c,,"Es gibt keine Verschnaufpause für die Schweizer Gletscher: in diesem Jahr wurde bei ihnen der viertgrößte Schwund seit Messbeginn 1950 erfasst. Ihr Volumen ging um drei Prozent zurück, wie das Gletsc… [+4175 chars]",,Die weißen Riesen zerfallen: Experten warnen vor dramatischem Gletscher-Sterben. Gletscherschwund im Rekordtempo: Warum ein schneearmer Winter und Hitzewellen das Schweizer Gebirge gefährlicher machen – und was das für Alpendörfer wie Blatten bedeutet.,The white giants are disintegrating: experts warn of dramatic glacier death. Glaciers are shrinking at a record pace: Why a winter with little snow and heat waves make the Swiss mountains more dangerous - and what that means for Alpine villages like Blatten.,Gigantes albi disintegrant: periti monent scenicam glaciem mortem. Glaciers in a commentariis gressum recusant: Cur hiems cum parvis nivis et aestu fluctibus montes Helvetiae periculosior est - et quid id significat ad Alpinas villas sicut Blatten.,2025-10-22 02:01:58+00:00
d95c915484e1d8977f97368459985b0f,2025-10-01T09:00:38Z,'Herbst',www.zeit.de,de,0.0,Blaulicht: Polizei warnt vor mehr Unfällen und Einbrüchen im Herbst,Hier finden Sie Informationen zu dem Thema „Blaulicht“. Lesen Sie jetzt „Polizei warnt vor mehr Unfällen und Einbrüchen im Herbst“.,https://www.zeit.de/news/2025-10/01/polizei-warnt-vor-mehr-unfaellen-und-einbruechen-im-herbst,https://img.zeit.de/news/2025-10/01/polizei-warnt-vor-mehr-unfaellen-und-einbruechen-im-herbst-image-group/wide__1300x731,,"Die Polizei warnt vor Einbrechern und Unfallgefahren im Herbst und Winter. Mit mehreren Aktionen in ganz Berlin wollen die Beamten im Oktober Menschen dafür sensibilisieren, wie die Polizei Berlin mi… [+720 chars]",,Blaulicht: Polizei warnt vor mehr Unfällen und Einbrüchen im Herbst. Hier finden Sie Informationen zu dem Thema „Blaulicht“. Lesen Sie jetzt „Polizei warnt vor mehr Unfällen und Einbrüchen im Herbst“.,Blue light: Police warn of more accidents and break-ins in the fall. Here you will find information on the subject of “blue light”. Read now “Police warn of more accidents and break-ins in the fall”.,"Lumen caeruleum: Vigilum moneo plura accidentia et dissolutiones in ruinam. Hic invenies informationes de re ""lucis caeruleae"". Lege nunc ""Vigilicum moneo plura accidentia et dissolutiones in ruinam"".",2025-10-22 02:01:58+00:00
ac4206bbf6601a2f23cbc22ed3a7a5d2,2025-10-01T09:00:38Z,'Winter',www.stern.de,de,0.0,Blaulicht: Polizei warnt vor mehr Unfällen und Einbrüchen im Herbst,"Dunkelheit, nasses Laub auf den Straßen oder Glätte: Im Herbst und Winter erhöht sich die Unfallgefahr. Aber auch Einbrüche gibt es vermehrt. Die Polizei Berlin warnt vor den Gefahren.",https://www.stern.de/gesellschaft/regional/berlin-brandenburg/blaulicht--polizei-warnt-vor-mehr-unfaellen-und-einbruechen-im-herbst-36096612.html,https://image.stern.de/36096614/t/wo/v1/w1440/r1.7778/-/01--xixg6zo7cqv5axs2048jpeg---36532674dc01c95f.jpg,,"Kopiere den aktuellen Link
Zur Merkliste hinzufügen
Dunkelheit, nasses Laub auf den Straßen oder Glätte: Im Herbst und Winter erhöht sich die Unfallgefahr. Aber auch Einbrüche gibt es vermehrt. Die… [+920 chars]",,"Blaulicht: Polizei warnt vor mehr Unfällen und Einbrüchen im Herbst. Dunkelheit, nasses Laub auf den Straßen oder Glätte: Im Herbst und Winter erhöht sich die Unfallgefahr. Aber auch Einbrüche gibt es vermehrt. Die Polizei Berlin warnt vor den Gefahren.","Blue light: Police warn of more accidents and break-ins in the fall. Darkness, wet leaves on the roads or slippery roads: the risk of accidents increases in autumn and winter. But burglaries are also increasing. The Berlin police warn of the dangers.","Lumen caeruleum: Vigilum moneo plura accidentia et dissolutiones in ruinam. Tenebrae, folia humida in viis vel viae lubricae: periculum accidentium auget autumno et hieme. Sed burgaria etiam augentur. Vigiles Berolinensis de periculis monent.",2025-10-22 02:01:58+00:00
6b8767ca2835b3008ffc4715b1fe8383,2025-10-01T09:01:50Z,'Winter',www.tagesspiegel.de,de,0.0,Dunkle Jahreszeit beginnt: Polizei Berlin warnt vor mehr Unfällen und Einbrüchen im Herbst,Im Herbst und Winter erhöht sich die Unfallgefahr. Aber auch Einbrüche gibt es vermehrt. Mit Aktionen will die Polizei Berlin die Menschen für die Gefahren sensibilisieren.,https://www.tagesspiegel.de/berlin/dunkle-jahreszeit-beginnt-polizei-berlin-warnt-vor-mehr-unfallen-und-einbruchen-im-herbst-14435873.html,https://www.tagesspiegel.de/images/14435870/alternates/BASE_16_9_W1400/1759309310000/radfahrer-in-der-dunkelheit.jpeg,,"Die Polizei warnt vor Einbrechern und Unfallgefahren im Herbst und Winter. Mit mehreren Aktionen in ganz Berlin wollen die Beamten im Oktober Menschen dafür sensibilisieren, wie die Polizei Berlin mi… [+975 chars]",,Dunkle Jahreszeit beginnt: Polizei Berlin warnt vor mehr Unfällen und Einbrüchen im Herbst. Im Herbst und Winter erhöht sich die Unfallgefahr. Aber auch Einbrüche gibt es vermehrt. Mit Aktionen will die Polizei Berlin die Menschen für die Gefahren sensibilisieren.,Dark season begins: Berlin police warn of more accidents and break-ins in autumn. The risk of accidents increases in autumn and winter. But burglaries are also increasing. The Berlin police want to make people aware of the dangers with campaigns.,Tempus obscurum incipit: Vigiles Berolini monent de pluribus accidentibus et in autumno dissoluendis. Periculum accidentium auget autumno et hieme. Sed burgaria etiam augentur. Vigiles Berolini volunt homines de periculis cum stipendiis cognoscere.,2025-10-22 02:01:58+00:00
269f66ea66b4a11e9be65ff2b38e230d,2025-10-01T09:28:36Z,'Schnee',www.faz.net,de,0.0,"Wenig Schnee, viel Hitze: Gletscher in der Schweiz sind in diesem Jahr deutlich geschrumpft",Auf einen schneearmen Winter folgten mehrere Hitzewellen: In diesem Jahr ging das Volumen der Schweizer Gletscher um drei Prozent zurück. Das hat Folgen für das Gestein und die umliegenden Orte.,https://www.faz.net/aktuell/gesellschaft/schweiz-gletscher-in-den-alpen-schrumpfen-2025-weiter-accg-110712116.html,https://media1.faz.net/ppmedia/w1200/aktuell/gesellschaft/1814428222/1.10712121/facebook_teaser/der-muttgletscher-in-den.jpg.webp,,"Es gibt keine Verschnaufpause für die Schweizer Gletscher: in diesem Jahr wurde bei ihnen der viertgrößte Schwund seit Messbeginn 1950 erfasst. Ihr Volumen ging um drei Prozent zurück, wie das Gletsc… [+2168 chars]",,"Wenig Schnee, viel Hitze: Gletscher in der Schweiz sind in diesem Jahr deutlich geschrumpft. Auf einen schneearmen Winter folgten mehrere Hitzewellen: In diesem Jahr ging das Volumen der Schweizer Gletscher um drei Prozent zurück. Das hat Folgen für das Gestein und die umliegenden Orte.","Little snow, lots of heat: glaciers in Switzerland have shrunk significantly this year. A winter with little snow was followed by several heat waves: this year the volume of Swiss glaciers fell by three percent. This has consequences for the rock and the surrounding places.","Parva nix, multae aestus: molibus in Helvetia hoc anno insigniter resiluit. Hiems exigua nix secuta est per aliquot fluctus aestus: hoc anno volubilis Helvetiorum molibus tribus centesimis cecidit. Hoc habet consequentia petrae et circa loca.",2025-10-22 02:01:58+00:00
1f08961cde23a2af540c20ead3b6f058,2025-10-01T10:35:56Z,'Winter',www.spektrum.de,de,0.0,"Wenig Schnee, viel Hitze: Klimawandel lässt Alpengletscher weiter schrumpfen",Gletscherschwund im Rekordtempo: Warum ein schneearmer Winter und Hitzewellen das Schweizer Gebirge gefährlicher machen – und was das für Alpendörfer wie Blatten bedeutet.,https://www.spektrum.de/news/klimawandel-wenig-schnee-viel-hitze-gletscher-schrumpfen-weiter/2289233,https://static.spektrum.de/fm/912/f1920x1080/GettyImages-996787872.jpg,,"Es gibt keine Verschnaufpause für die Schweizer Gletscher: in diesem Jahr wurde bei ihnen der viertgrößte Schwund seit Messbeginn 1950 erfasst. Ihr Volumen ging um drei Prozent zurück, wie das Gletsc… [+876 chars]",,"Wenig Schnee, viel Hitze: Klimawandel lässt Alpengletscher weiter schrumpfen. Gletscherschwund im Rekordtempo: Warum ein schneearmer Winter und Hitzewellen das Schweizer Gebirge gefährlicher machen – und was das für Alpendörfer wie Blatten bedeutet.","Little snow, lots of heat: climate change is causing Alpine glaciers to continue to shrink. Glaciers are shrinking at a record pace: Why a winter with little snow and heat waves make the Swiss mountains more dangerous - and what that means for Alpine villages like Blatten.","Parva nix, multum caloris: mutatio climatis Alpinas molibus causat ut continue reformidant. Glaciers in a commentariis gressum recusant: Cur hiems cum parvis nivis et aestu fluctibus montes Helvetiae periculosior est - et quid id significat ad Alpinas villas sicut Blatten.",2025-10-22 02:01:58+00:00
8147e2a0c8f17ccddd901d2a9e95b39b,2025-10-01T10:57:03Z,'Hochwasser',www.zeit.de,de,0.0,Hochwasserschutz: Länder arbeiten bei Deichrückverlegungen enger zusammen,Hier finden Sie Informationen zu dem Thema „Hochwasserschutz“. Lesen Sie jetzt „Länder arbeiten bei Deichrückverlegungen enger zusammen“.,https://www.zeit.de/news/2025-10/01/laender-arbeiten-bei-deichrueckverlegungen-enger-zusammen,https://img.zeit.de/news/2025-10/01/laender-arbeiten-bei-deichrueckverlegungen-enger-zusammen-image-group/wide__1300x731,,"Die Elbe soll durch Deichrückverlegungen mehr Platz bekommen und so der Hochwasserschutz verstärkt werden: Sachsen-Anhalt, Niedersachsen und Brandenburg arbeiten dabei verstärkt zusammen. In Iden im … [+956 chars]",,Hochwasserschutz: Länder arbeiten bei Deichrückverlegungen enger zusammen. Hier finden Sie Informationen zu dem Thema „Hochwasserschutz“. Lesen Sie jetzt „Länder arbeiten bei Deichrückverlegungen enger zusammen“.,Flood protection: Countries are working more closely together when it comes to relocating dikes. Here you will find information on the topic of “flood protection”. Now read “Countries are working more closely together on dike relocations”.,"Diluvium praesidium: regiones arctius simul laborant cum ad fossata transvolare. Hic informationes invenies in argumento ""diluvii tutelae"". Nunc lege "" regiones arctius in fossato relocations operantur"".",2025-10-22 02:01:58+00:00
15c38264b0231c82318a5cdf4dbc6faf,2025-10-01T10:57:03Z,'Hochwasser',www.stern.de,de,0.0,Hochwasserschutz: Länder arbeiten bei Deichrückverlegungen enger zusammen,"Die Elbe soll mehr Raum bekommen, um sich bei Hochwasser auszubreiten. Sachsen-Anhalt, Brandenburg und Niedersachsen arbeiten dabei enger zusammen.",https://www.stern.de/gesellschaft/regional/berlin-brandenburg/hochwasserschutz--laender-arbeiten-bei-deichrueckverlegungen-enger-zusammen-36097152.html,https://image.stern.de/36097154/t/UD/v1/w1440/r1.7778/-/01--fyetthx56av6axs2048jpeg---cee6ec35e9582baa.jpg,,"Kopiere den aktuellen Link
Zur Merkliste hinzufügen
Die Elbe soll mehr Raum bekommen, um sich bei Hochwasser auszubreiten. Sachsen-Anhalt, Brandenburg und Niedersachsen arbeiten dabei enger zusamme… [+1119 chars]",,"Hochwasserschutz: Länder arbeiten bei Deichrückverlegungen enger zusammen. Die Elbe soll mehr Raum bekommen, um sich bei Hochwasser auszubreiten. Sachsen-Anhalt, Brandenburg und Niedersachsen arbeiten dabei enger zusammen.","Flood protection: Countries are working more closely together when it comes to relocating dikes. The Elbe should be given more space to expand during floods. Saxony-Anhalt, Brandenburg and Lower Saxony are working more closely together.","Diluvium praesidium: regiones arctius simul laborant cum ad fossata transvolare. Albis plus spatii detur ut per inundationes amplietur. Saxonia-Anhalt, Brandenburgica et Inferior Saxonia arctius inter se laborant.",2025-10-22 02:01:58+00:00
e44369f2b59e7a36d8d96734591f3225,2025-10-01T10:58:10Z,'Erle',www.tagesspiegel.de,de,0.0,Hochwasserschutz: Länder arbeiten bei Deichrückverlegungen enger zusammen,"Die Elbe soll mehr Raum bekommen, um sich bei Hochwasser auszubreiten. Sachsen-Anhalt, Brandenburg und Niedersachsen arbeiten dabei enger zusammen.",https://www.tagesspiegel.de/berlin/hochwasserschutz-lander-arbeiten-bei-deichruckverlegungen-enger-zusammen-14437892.html,https://www.tagesspiegel.de/images/14437889/alternates/BASE_16_9_W1400/1759316289000/nach-dem-hochwasser-wittenberge.jpeg,,"Die Elbe soll durch Deichrückverlegungen mehr Platz bekommen und so der Hochwasserschutz verstärkt werden: Sachsen-Anhalt, Niedersachsen und Brandenburg arbeiten dabei verstärkt zusammen. In Iden im … [+1006 chars]",,"Hochwasserschutz: Länder arbeiten bei Deichrückverlegungen enger zusammen. Die Elbe soll mehr Raum bekommen, um sich bei Hochwasser auszubreiten. Sachsen-Anhalt, Brandenburg und Niedersachsen arbeiten dabei enger zusammen.","Flood protection: Countries are working more closely together when it comes to relocating dikes. The Elbe should be given more space to expand during floods. Saxony-Anhalt, Brandenburg and Lower Saxony are working more closely together.","Diluvium praesidium: regiones arctius simul laborant cum ad fossata transvolare. Albis plus spatii detur ut per inundationes amplietur. Saxonia-Anhalt, Brandenburgica et Inferior Saxonia arctius inter se laborant.",2025-10-22 02:01:58+00:00
abf19955a6300e8e4cf0d7385b0540ed,2025-10-01T11:02:00Z,'Schnee',www.tagesschau.de,de,0.0,Schweizer Alpen-Gletscher schmelzen weiter in Rekordtempo,"Die Gletscher in den Alpen schwinden im Rekordtempo. Schneemangel und Hitzewellen haben auch in diesem Jahr die Eisschmelze vorangetrieben, zeigt ein Bericht. Seit 2015 ist ein Viertel des ""ewigen Eises"" geschmolzen. Von Kathrin Hondl.",https://www.tagesschau.de/wissen/klima/schweizer-alpen-gletscher-schmelze-100.html,https://images.tagesschau.de/image/209699be-0e12-45a0-b1a9-baff94f507a1/AAABmZ9Kl4Y/AAABmKJZ-0g/16x9-big/clariden-100.jpg?width=1280,,"Stand: 01.10.2025 13:02 Uhr
Die Gletscher in den Alpen schwinden im Rekordtempo. Schneemangel und Hitzewellen haben auch in diesem Jahr die Eisschmelze vorangetrieben, zeigt ein Bericht. Seit 2015 i… [+4464 chars]",,"Schweizer Alpen-Gletscher schmelzen weiter in Rekordtempo. Die Gletscher in den Alpen schwinden im Rekordtempo. Schneemangel und Hitzewellen haben auch in diesem Jahr die Eisschmelze vorangetrieben, zeigt ein Bericht. Seit 2015 ist ein Viertel des ""ewigen Eises"" geschmolzen. Von Kathrin Hondl.","Swiss Alpine glaciers continue to melt at a record pace. The glaciers in the Alps are disappearing at a record pace. Lack of snow and heat waves have also driven ice melt this year, a report shows. Since 2015, a quarter of the ""eternal ice"" has melted. By Kathrin Hondl.","Helvetii pergunt molibus Alpinis in memoria gressu conflare. Moles in Alpibus memoria gressu evanescunt. Defectus nivis et caloris fluctus etiam glaciali dissolvi hoc anno acti, rumorem ostendit. Ab anno 2015 quarta pars ""glacie aeternae"" liquefacta est. Excudebat Kathrin Hondl.",2025-10-22 02:01:58+00:00
